310M100US27500,27500,"Janesville, WI Metro Area",39668,533,39056,706,25418,2439,4166,1408,9472,2329,612,469
310M100US27620,27620,"Jefferson City, MO Metro Area",32131,2845,31972,2839,22312,2165,2054,1014,7606,2137,159,167
310M100US27740,27740,"Johnson City, TN Metro Area",39911,891,39205,964,27438,2364,2860,1118,8907,2235,706,596
310M100US27780,27780,"Johnstown, PA Metro Area",28088,214,27837,313,19464,1322,1664,782,6709,1146,251,210
310M100US27860,27860,"Jonesboro, AR Metro Area",29615,1081,29362,1096,17978,2308,2944,1669,8440,2199,253,335
310M100US27900,27900,"Joplin, MO Metro Area",44503,1107,42953,1559,29580,2604,2598,920,10775,2175,1550,1116
310M100US27980,27980,"Kahului-Wailuku, HI Micro Area",35585,918,34991,1137,24230,2119,3673,1381,7088,1779,594,668
310M100US28020,28020,"Kalamazoo-Portage, MI Metro Area",76528,304,75812,544,48616,2548,5601,1553,21595,2172,716,438
310M100US28060,28060,"Kalispell, MT Micro Area",21172,149,21059,196,14390,1658,2833,1428,3836,1199,113,136
310M100US28100,28100,"Kankakee-Bradley, IL Metro Area",28647,256,28599,264,17465,1967,2534,1332,8600,1607,48,79
310M100US28140,28140,"Kansas City, MO-KS Metro Area",518918,2355,515887,2593,351152,8767,41266,5243,123469,8609,3031,1210
310M100US28180,28180,"Kapaa, HI Micro Area",15335,5,14862,518,10666,1226,1059,570,3137,1055,473,518
310M100US28300,28300,"Keene, NH Micro Area",15053,4,14884,166,9772,1305,1042,698,4070,1151,169,166
310M100US28420,28420,"Kennewick-Pasco-Richland, WA Metro Area",74965,555,74202,818,52271,3502,6772,2406,15159,3084,763,711
310M100US28580,28580,"Key West, FL Micro Area",11015,5,10985,57,7000,1214,2016,1113,1969,962,30,59
310M100US28660,28660,"Killeen-Temple-Fort Hood, TX Metro Area",113750,2009,112992,2363,73225,4548,5744,2110,34023,4416,758,880
310M100US28700,28700,"Kingsport-Bristol-Bristol, TN-VA Metro Area",64201,1681,62826,1686,41144,3304,4100,1461,17582,2729,1375,1038
310M100US28740,28740,"Kingston, NY Metro Area",35632,1049,35632,1049,23763,2311,2748,1472,9121,2064,0,275
310M100US28900,28900,"Klamath Falls, OR Micro Area",14175,941,14004,998,9816,1420,603,361,3585,1062,171,280
310M100US28940,28940,"Knoxville, TN Metro Area",153031,1254,152648,1282,105594,3872,10516,2717,36538,3675,383,262
310M100US29020,29020,"Kokomo, IN Metro Area",23241,1349,23241,1349,15575,2066,1927,1366,5739,1626,0,267
310M100US29100,29100,"La Crosse, WI-MN Metro Area",28476,608,28223,623,20975,1582,3031,1341,4217,1197,253,299
310M100US29140,29140,"Lafayette, IN Metro Area",43269,1521,43011,1525,31261,2096,3397,1254,8353,1568,258,334
310M100US29180,29180,"Lafayette, LA Metro Area",67981,7,67607,446,38868,3067,3394,1549,25345,3049,374,445
310M100US29300,29300,"LaGrange, GA Micro Area",17515,301,17442,339,10205,1796,295,299,6942,1727,73,125
310M100US29340,29340,"Lake Charles, LA Metro Area",50129,945,49824,1038,31762,2870,2399,1005,15663,2745,305,405
310M100US29380,29380,"Lake City, FL Micro Area",15086,1269,15005,1275,8323,1914,1524,1115,5158,1591,81,144
310M100US29420,29420,"Lake Havasu City-Kingman, AZ Metro Area",41049,685,40807,782,23910,2915,3920,1608,12977,2702,242,245
310M100US29460,29460,"Lakeland-Winter Haven, FL Metro Area",141106,759,140724,867,89369,5333,13139,3220,38216,4816,382,450
310M100US29540,29540,"Lancaster, PA Metro Area",128317,154,127034,795,100478,3467,5515,1776,21041,3149,1283,773
310M100US29580,29580,"Lancaster, SC Micro Area",17855,4,17855,4,8598,1514,537,378,8720,1584,0,296
310M100US29620,29620,"Lansing-East Lansing, MI Metro Area",101438,543,100903,684,70069,2995,5547,1318,25287,2881,535,330
310M100US29700,29700,"Laredo, TX Metro Area",87561,598,87107,746,52606,4637,6835,2575,27666,4251,454,456
310M100US29740,29740,"Las Cruces, NM Metro Area",55975,686,55975,686,37047,2639,3813,1745,15115,2628,0,285
310M100US29820,29820,"Las Vegas-Paradise, NV Metro Area",487292,590,484352,1298,309238,10231,50731,6263,124383,8828,2940,1146
310M100US29860,29860,"Laurel, MS Micro Area",21011,1356,20795,1413,11132,2130,2211,1960,7452,2248,216,371
310M100US29940,29940,"Lawrence, KS Metro Area",21101,110,20749,394,14570,1458,659,517,5520,1396,352,378
310M100US30020,30020,"Lawton, OK Metro Area",30936,624,30294,1030,16337,2160,3068,1217,10889,2297,642,784
310M100US30100,30100,"Lebanon, NH-VT Micro Area",34062,493,33590,657,23103,1468,2356,921,8131,1381,472,421
310M100US30140,30140,"Lebanon, PA Metro Area",30547,274,30547,274,22715,1929,2829,1324,5003,1379,0,246
310M100US30300,30300,"Lewiston, ID-WA Metro Area",12940,1035,12621,1083,7719,1043,1611,770,3291,1100,319,398
310M100US30340,30340,"Lewiston-Auburn, ME Metro Area",23977,210,23924,235,13949,2038,1903,856,8072,1893,53,93
310M100US30460,30460,"Lexington-Fayette, KY Metro Area",105745,1560,105012,1616,66747,3619,6309,1724,31956,3804,733,603
310M100US30500,30500,"Lexington Park, MD Micro Area",27544,195,27377,344,19934,1448,1205,683,6238,1217,167,286
310M100US30620,30620,"Lima, OH Metro Area",25312,118,25222,200,14344,1468,1898,890,8980,1290,90,147
310M100US30700,30700,"Lincoln, NE Metro Area",70092,839,68934,1189,52042,2600,3229,1181,13663,2368,1158,855
310M100US30740,30740,"Lincolnton, NC Micro Area",18477,3,17678,910,12324,1589,1677,862,3677,1330,799,910
310M100US30780,30780,"Little Rock-North Little Rock-Conway, AR Metro Area",168052,1422,166166,1770,101129,3913,8897,2130,56140,4445,1886,1078
310M100US30860,30860,"Logan, UT-ID Metro Area",39890,842,39890,842,33982,1789,957,622,4951,1548,0,273
310M100US30980,30980,"Longview, TX Metro Area",52040,1092,51678,1288,31023,2812,5281,2360,15374,2598,362,525
310M100US31020,31020,"Longview, WA Metro Area",24493,187,24493,187,15532,1654,1808,997,7153,1665,0,277
310M100US31100,31100,"Los Angeles-Long Beach-Santa Ana, CA Metro Area",3127947,4979,3113541,5527,2062086,23963,282678,10944,768777,21873,14406,2825
310M100US31140,31140,"Louisville/Jefferson County, KY-IN Metro Area",308607,2273,305168,2784,188722,6145,24302,3929,92144,5920,3439,1435
310M100US31180,31180,"Lubbock, TX Metro Area",70155,729,69516,773,41423,3262,6434,2414,21659,3111,639,409
310M100US31260,31260,"Lufkin, TX Micro Area",22312,1387,22312,1387,14626,2019,2095,1020,5591,1354,0,294
310M100US31300,31300,"Lumberton, NC Micro Area",35824,57,35744,125,16391,2426,3242,1421,16111,2694,80,112
310M100US31340,31340,"Lynchburg, VA Metro Area",53708,2216,53473,2269,32798,3136,4498,1689,16177,2893,235,252
310M100US31420,31420,"Macon, GA Metro Area",54895,2150,54177,2110,28499,2977,2287,1102,23391,2678,718,497
310M100US31460,31460,"Madera-Chowchilla, CA Metro Area",41883,801,41642,914,26569,3192,2918,1232,12155,2783,241,378
310M100US31540,31540,"Madison, WI Metro Area",124732,843,124031,953,91958,3168,8521,2574,23552,3136,701,495
310M100US31700,31700,"Manchester-Nashua, NH Metro Area",93988,62,93147,539,67098,3050,8057,2582,17992,2559,841,536
310M100US31740,31740,"Manhattan, KS Metro Area",29987,1221,29257,1403,21171,2315,539,539,7547,1904,730,726
310M100US31820,31820,"Manitowoc, WI Micro Area",18181,189,17855,484,13726,1162,1300,666,2829,923,326,432
310M100US31860,31860,"Mankato-North Mankato, MN Metro Area",20519,918,20241,962,14956,1137,844,418,4441,1518,278,219
310M100US31900,31900,"Mansfield, OH Metro Area",27927,369,27113,858,19458,1796,1407,706,6248,1530,814,786
310M100US31940,31940,"Marinette, WI-MI Micro Area",13618,675,13559,662,9547,908,832,346,3180,1004,59,81
310M100US31980,31980,"Marion, IN Micro Area",15132,4,15083,88,9822,1366,1688,853,3573,1176,49,88
310M100US32020,32020,"Marion, OH Micro Area",14178,185,13704,688,6966,1677,1997,1015,4741,1773,474,686
310M100US32060,32060,"Marion-Herrin, IL Micro Area",14683,4,14683,4,10684,927,365,233,3634,891,0,267
310M100US32100,32100,"Marquette, MI Micro Area",12398,200,12398,200,10132,652,668,334,1598,538,0,244
310M100US32220,32220,"Marshall, TX Micro Area",16962,4,16864,165,9657,1475,1129,707,6078,1465,98,165
310M100US32270,32270,"Marshfield-Wisconsin Rapids, WI Micro Area",16946,411,16741,438,12293,1330,1818,688,2630,1258,205,162
310M100US32300,32300,"Martinsville, VA Micro Area",13323,738,13323,738,8105,1262,1039,651,4179,1108,0,287
310M100US32420,32420,"Mayagüez, PR Metro Area",20249,1106,20249,1106,10437,1940,1177,690,8635,1903,0,285
310M100US32580,32580,"McAllen-Edinburg-Mission, TX Metro Area",270130,583,268573,1614,179942,8611,12810,3056,75821,8012,1557,1376
310M100US32740,32740,"Meadville, PA Micro Area",19292,499,19277,500,12914,1206,2235,962,4128,1043,15,25
310M100US32780,32780,"Medford, OR Metro Area",44238,283,44223,283,27857,2257,5150,1856,11216,2442,15,25
310M100US32820,32820,"Memphis, TN-MS-AR Metro Area",345519,2634,344456,2841,181747,6441,27616,4438,135093,7338,1063,731
310M100US32900,32900,"Merced, CA Metro Area",81044,253,80883,330,56041,3528,7453,2343,17389,3066,161,200
310M100US32940,32940,"Meridian, MS Micro Area",26900,1321,26726,1338,14111,2038,2245,995,10370,2073,174,286
310M100US33100,33100,"Miami-Fort Lauderdale-Pompano Beach, FL Metro Area",1204244,1557,1196724,2486,727049,12618,88432,7813,381243,12750,7520,2244
310M100US33140,33140,"Michigan City-La Porte, IN Metro Area",25301,63,25242,97,17299,1456,1984,919,5959,1514,59,75
310M100US33220,33220,"Midland, MI Micro Area",19312,413,19068,581,15113,1184,841,486,3114,941,244,372
310M100US33260,33260,"Midland, TX Metro Area",37321,192,36908,669,21149,2545,1512,918,14247,2548,413,643
310M100US33340,33340,"Milwaukee-Waukesha-West Allis, WI Metro Area",381647,964,379158,1440,234301,6643,28304,5046,116553,6712,2489,1286
310M100US33460,33460,"Minneapolis-St. Paul-Bloomington, MN-WI Metro Area",816909,1615,812351,2166,591989,8977,53265,5850,167097,8105,4558,1554
310M100US33500,33500,"Minot, ND Micro Area",16076,668,15844,744,11435,1257,662,387,3747,1296,232,245
310M100US33540,33540,"Missoula, MT Metro Area",21413,625,21413,625,15545,1882,2221,1109,3647,1466,0,237
310M100US33660,33660,"Mobile, AL Metro Area",103186,81,102171,682,60416,4530,6517,2321,35238,4106,1015,672
310M100US33700,33700,"Modesto, CA Metro Area",146354,1152,145512,1383,99306,3911,13183,2494,33023,3628,842,748
310M100US33740,33740,"Monroe, LA Metro Area",41669,4368,41483,4372,20399,2868,3842,1696,17242,3614,186,306
310M100US33780,33780,"Monroe, MI Metro Area",36070,498,35975,504,26006,1818,1596,664,8373,1744,95,117
310M100US33860,33860,"Montgomery, AL Metro Area",91943,1170,91351,1235,52096,3292,5930,1563,33325,2809,592,464
310M100US33980,33980,"Morehead City, NC Micro Area",12593,3,12593,3,7520,1295,1428,753,3645,1435,0,289
310M100US34060,34060,"Morgantown, WV Metro Area",21072,1115,20769,1063,15435,1501,1092,640,4242,1449,303,281
310M100US34100,34100,"Morristown, TN Metro Area",30918,1154,30620,1158,21429,2142,2359,1036,6832,1524,298,405
310M100US34180,34180,"Moses Lake, WA Micro Area",27468,339,27404,356,19353,2233,1983,977,6068,2099,64,108
310M100US34340,34340,"Mount Airy, NC Micro Area",17188,8,17106,128,10574,1509,1471,1026,5061,1507,82,128
310M100US34380,34380,"Mount Pleasant, MI Micro Area",12023,357,11883,317,8363,865,1249,499,2271,750,140,121
310M100US34580,34580,"Mount Vernon-Anacortes, WA Metro Area",27600,218,27458,243,17411,1879,3480,1334,6567,1528,142,166
310M100US34620,34620,"Muncie, IN Metro Area",23153,424,22847,577,12384,1653,2589,1203,7874,1762,306,424
310M100US34740,34740,"Muskegon-Norton Shores, MI Metro Area",42687,158,42211,392,24446,2126,2955,1016,14810,2166,476,323
310M100US34780,34780,"Muskogee, OK Micro Area",17521,4,17369,240,9159,1418,1582,987,6628,1412,152,241
310M100US34820,34820,"Myrtle Beach-North Myrtle Beach-Conway, SC Metro Area",54325,284,53355,1058,32371,2807,4531,1414,16453,2403,970,1045
310M100US34900,34900,"Napa, CA Metro Area",31675,223,31377,464,23781,1807,1748,871,5848,1683,298,401
310M100US34940,34940,"Naples-Marco Island, FL Metro Area",62725,7,62041,718,40504,2787,5060,1459,16477,2580,684,718
310M100US34980,34980,"Nashville-Davidson--Murfreesboro--Franklin, TN Metro Area",386424,1976,383166,2587,250423,6940,25750,3656,106993,6561,3258,1694
310M100US35100,35100,"New Bern, NC Micro Area",27956,1081,27680,1176,16338,2051,1821,1146,9521,1929,276,363
310M100US35260,35260,"New Castle, PA Micro Area",19379,234,19323,240,12697,1162,1629,816,4997,971,56,70
310M100US35300,35300,"New Haven-Milford, CT Metro Area",191853,338,190514,976,121381,5137,10289,2429,58844,5305,1339,880
310M100US35340,35340,"New Iberia, LA Micro Area",19937,640,19698,527,8622,1867,2069,972,9007,1863,239,380
310M100US35380,35380,"New Orleans-Metairie-Kenner, LA Metro Area",273044,995,272036,1139,155784,6616,15197,2822,101055,6656,1008,545
310M100US35420,35420,"New Philadelphia-Dover, OH Micro Area",21783,715,21783,715,16363,1433,1258,892,4162,1307,0,269
310M100US35620,35620,"New York-Northern New Jersey-Long Island, NY-NJ-PA Metro Area",4283814,5220,4266555,6221,2878764,23492,274946,11666,1112845,20202,17259,3092
310M100US35660,35660,"Niles-Benton Harbor, MI Metro Area",36295,443,36295,443,22039,2008,2425,1115,11831,1793,0,244
310M100US35840,35840,"North Port-Bradenton-Sarasota, FL Metro Area",125701,383,123782,1370,73448,4718,12468,3387,37866,3435,1919,1323
310M100US35900,35900,"North Wilkesboro, NC Micro Area",15503,375,15453,393,12692,1256,449,444,2312,1147,50,88
310M100US35980,35980,"Norwich-New London, CT Metro Area",58438,1202,58079,1240,37012,3021,5175,1914,15892,2962,359,399
310M100US36020,36020,"Oak Harbor, WA Micro Area",16346,386,16346,386,13342,1134,633,488,2371,994,0,277
310M100US36100,36100,"Ocala, FL Metro Area",63582,514,63369,537,36580,3392,6291,2487,20498,3006,213,241
310M100US36140,36140,"Ocean City, NJ Metro Area",18136,123,18055,187,12566,1539,1584,814,3905,1374,81,131
310M100US36220,36220,"Odessa, TX Metro Area",39862,325,38926,943,20761,2717,5885,2285,12280,2547,936,884
310M100US36260,36260,"Ogden-Clearfield, UT Metro Area",178491,1007,178049,1045,142019,4499,9185,2347,26845,3955,442,447
310M100US36300,36300,"Ogdensburg-Massena, NY Micro Area",23082,473,22842,592,15202,1662,2932,1523,4708,1123,240,389
310M100US36420,36420,"Oklahoma City, OK Metro Area",313719,1281,312153,1504,206529,6676,20992,3852,84632,6597,1566,874
310M100US36460,36460,"Olean, NY Micro Area",18156,309,18045,322,12455,1321,1877,731,3713,1161,111,104
310M100US36500,36500,"Olympia, WA Metro Area",58222,5,57877,341,42023,2887,2828,1219,13026,2687,345,341
310M100US36540,36540,"Omaha-Council Bluffs, NE-IA Metro Area",223953,1778,221914,1933,155762,5085,17217,3496,48935,4610,2039,1261
310M100US36660,36660,"Opelousas-Eunice, LA Micro Area",22826,445,22648,492,13273,1968,981,759,8394,2319,178,212
310M100US36700,36700,"Orangeburg, SC Micro Area",21559,356,21559,356,10187,1821,1532,838,9840,1938,0,296
310M100US36740,36740,"Orlando-Kissimmee-Sanford, FL Metro Area",498383,1922,493826,2604,317428,10761,33995,6175,142403,8507,4557,1560
310M100US36780,36780,"Oshkosh-Neenah, WI Metro Area",34704,847,34138,927,24422,1725,3071,1279,6645,1541,566,328
310M100US36860,36860,"Ottawa-Streator, IL Micro Area",35602,486,35602,486,24624,1986,2137,887,8841,1893,0,267
310M100US36980,36980,"Owensboro, KY Metro Area",27327,1241,27244,1278,17751,2018,1565,797,7928,1758,83,133
310M100US37020,37020,"Owosso, MI Micro Area",17354,260,16908,537,12074,1136,1666,811,3168,1026,446,448
310M100US37100,37100,"Oxnard-Thousand Oaks-Ventura, CA Metro Area",211292,1454,210115,1537,152902,5715,18478,4208,38735,5250,1177,602
310M100US37140,37140,"Paducah, KY-IL Micro Area",21573,1257,21168,1298,13540,1583,2006,1026,5622,1698,405,342
310M100US37260,37260,"Palatka, FL Micro Area",16585,184,16112,644,9331,1464,1838,913,4943,1516,473,584
310M100US37340,37340,"Palm Bay-Melbourne-Titusville, FL Metro Area",106540,1396,105980,1407,69938,4575,8797,2681,27245,4253,560,399
310M100US37380,37380,"Palm Coast, FL Metro Area",19036,5,18704,508,12925,1478,457,397,5322,1698,332,508
310M100US37460,37460,"Panama City-Lynn Haven-Panama City Beach, FL Metro Area",36766,618,36548,672,23612,2699,3736,1610,9200,2340,218,267
310M100US37620,37620,"Parkersburg-Marietta-Vienna, WV-OH Metro Area",35503,993,35390,1012,27604,1668,1551,734,6235,1395,113,181
310M100US37700,37700,"Pascagoula, MS Metro Area",42272,657,41772,773,25001,2630,2217,1013,14554,2435,500,506
310M100US37820,37820,"Pendleton-Hermiston, OR Micro Area",23592,1182,23549,1184,14558,1915,2477,976,6514,1734,43,75
310M100US37860,37860,"Pensacola-Ferry Pass-Brent, FL Metro Area",99082,855,97363,1183,60032,4275,4998,1567,32333,3998,1719,899
310M100US37900,37900,"Peoria, IL Metro Area",90564,873,89470,1316,60680,3085,7036,2064,21754,3093,1094,954
310M100US37980,37980,"Philadelphia-Camden-Wilmington, PA-NJ-DE-MD Metro Area",1384250,1631,1377627,2588,904723,13510,85709,6783,387195,14219,6623,1793
310M100US38060,38060,"Phoenix-Mesa-Glendale, AZ Metro Area",1107447,716,1101466,2161,722825,13968,103919,10400,274722,13195,5981,1911
310M100US38220,38220,"Pine Bluff, AR Metro Area",22581,1096,22479,1118,10272,1802,1102,692,11105,1598,102,168
310M100US38300,38300,"Pittsburgh, PA Metro Area",471180,1316,467967,1599,322557,7815,32772,4966,112638,6740,3213,1296
310M100US38340,38340,"Pittsfield, MA Metro Area",24685,769,24685,769,15701,1391,3447,1308,5537,1123,0,285
310M100US38460,38460,"Plattsburgh, NY Micro Area",15953,402,15648,514,10782,1454,1366,825,3500,1229,305,347
310M100US38540,38540,"Pocatello, ID Metro Area",25736,1537,25689,1529,18945,2543,1805,1116,4939,1649,47,91
310M100US38660,38660,"Ponce, PR Metro Area",61104,867,61042,860,27209,2947,6602,1885,27231,2607,62,105
310M100US38820,38820,"Port Angeles, WA Micro Area",13365,294,13295,335,8447,1405,336,271,4512,1506,70,123
310M100US38860,38860,"Portland-South Portland-Biddeford, ME Metro Area",107880,690,107537,763,74130,4123,7795,2232,25612,3380,343,310
310M100US38900,38900,"Portland-Vancouver-Hillsboro, OR-WA Metro Area",528349,1231,523550,1854,377934,8324,34470,4438,111146,7291,4799,1439
310M100US38940,38940,"Port St. Lucie, FL Metro Area",87528,689,85470,1823,53961,3845,6360,2148,25149,3742,2058,1673
310M100US39020,39020,"Portsmouth, OH Micro Area",17410,542,17263,518,12047,1432,1534,688,3682,1324,147,200
310M100US39060,39060,"Pottsville, PA Micro Area",29391,345,28950,499,19391,1737,2737,874,6822,1702,441,300
310M100US39100,39100,"Poughkeepsie-Newburgh-Middletown, NY Metro Area",167208,317,166841,446,124860,4209,9084,2325,32897,4052,367,322
310M100US39140,39140,"Prescott, AZ Metro Area",40287,592,39018,1125,26615,2734,4863,1833,7540,2226,1269,1144
310M100US39300,39300,"Providence-New Bedford-Fall River, RI-MA Metro Area",344982,890,343496,1146,220502,6014,20945,3312,102049,6301,1486,729
310M100US39340,39340,"Provo-Orem, UT Metro Area",182837,1406,182276,1372,162604,3833,4973,1981,14699,3482,561,561
310M100US39380,39380,"Pueblo, CO Metro Area",39014,753,38504,932,21343,2680,4009,1295,13152,2752,510,497
310M100US39460,39460,"Punta Gorda, FL Metro Area",22969,192,22969,192,15278,2110,1418,891,6273,1878,0,310
310M100US39500,39500,"Quincy, IL-MO Micro Area",17487,563,17085,761,11651,1233,1036,602,4398,1055,402,468
310M100US39540,39540,"Racine, WI Metro Area",47952,906,47210,1145,30965,2310,1993,823,14252,2379,742,573
310M100US39580,39580,"Raleigh-Cary, NC Metro Area",297046,1233,294775,1656,212341,6335,14944,2787,67490,5950,2271,965
310M100US39660,39660,"Rapid City, SD Metro Area",30553,472,30247,608,21335,1862,2257,1122,6655,1803,306,341
310M100US39740,39740,"Reading, PA Metro Area",97544,747,96406,1106,59889,3247,7586,2278,28931,2947,1138,886
310M100US39820,39820,"Redding, CA Metro Area",39510,27,39200,347,27226,2743,2918,1636,9056,2163,310,348
310M100US39900,39900,"Reno-Sparks, NV Metro Area",100291,545,99395,1003,66610,3817,9927,2512,22858,3857,896,816
310M100US39980,39980,"Richmond, IN Micro Area",15789,214,15652,258,8160,1368,996,1003,6496,1403,137,161
310M100US40060,40060,"Richmond, VA Metro Area",291958,3641,290766,3524,182274,6435,22016,3696,86476,6294,1192,617
310M100US40080,40080,"Richmond-Berea, KY Micro Area",21073,1314,20939,1325,13259,1861,1535,819,6145,1769,134,228
310M100US40140,40140,"Riverside-San Bernardino-Ontario, CA Metro Area",1218120,1098,1211199,2479,810982,16053,109256,9014,290961,15097,6921,2324
310M100US40220,40220,"Roanoke, VA Metro Area",65123,1662,65002,1689,42463,2524,3275,1370,19264,2513,121,165
310M100US40260,40260,"Roanoke Rapids, NC Micro Area",16857,710,16699,774,7530,1108,963,695,8206,1226,158,217
310M100US40340,40340,"Rochester, MN Metro Area",47507,118,46435,1023,35077,1994,3183,1042,8175,1900,1072,1005
310M100US40380,40380,"Rochester, NY Metro Area",236461,1079,234507,1432,148223,5238,14468,2499,71816,5493,1954,1064
310M100US40420,40420,"Rockford, IL Metro Area",88159,1035,87595,1120,52467,3812,5342,1967,29786,3671,564,574
310M100US40580,40580,"Rocky Mount, NC Metro Area",36551,210,36230,331,19465,1997,3281,1277,13484,2192,321,301
310M100US40660,40660,"Rome, GA Metro Area",23176,223,23120,237,17305,1679,2439,1650,3376,1442,56,105
310M100US40700,40700,"Roseburg, OR Micro Area",22136,425,22022,475,14928,1712,1758,878,5336,1524,114,190
310M100US40740,40740,"Roswell, NM Micro Area",17721,1317,17598,1421,11071,1733,1456,1244,5071,1728,123,238
310M100US40780,40780,"Russellville, AR Micro Area",20113,885,20057,898,13348,1907,2420,1088,4289,1340,56,106
310M100US40900,40900,"Sacramento--Arden-Arcade--Roseville, CA Metro Area",533108,2431,527885,3371,366153,9558,39007,4528,122725,9625,5223,2192
310M100US40980,40980,"Saginaw-Saginaw Township North, MI Metro Area",46598,253,45531,1114,30189,2209,3446,1166,11896,2087,1067,1132
310M100US41060,41060,"St. Cloud, MN Metro Area",44268,479,43895,662,33664,2032,3205,973,7026,1616,373,432
310M100US41100,41100,"St. George, UT Metro Area",41670,493,41653,497,36568,1762,1707,826,3378,1659,17,28
310M100US41140,41140,"St. Joseph, MO-KS Metro Area",29496,1392,29046,1449,18485,2202,2033,841,8528,1798,450,433
310M100US41180,41180,"St. Louis, MO-IL Metro Area",667637,1932,663364,2418,433298,9622,42763,5192,187303,8152,4273,1521
310M100US41420,41420,"Salem, OR Metro Area",101370,473,100756,782,71758,4006,5716,1990,23282,3970,614,657
310M100US41500,41500,"Salinas, CA Metro Area",111242,376,110741,500,72649,3966,12371,3065,25721,3770,501,418
310M100US41540,41540,"Salisbury, MD Metro Area",25933,853,25838,873,16025,2195,2600,1277,7213,1994,95,122
310M100US41580,41580,"Salisbury, NC Micro Area",32715,311,32460,377,20683,3023,3778,2120,7999,2174,255,191
310M100US41620,41620,"Salt Lake City, UT Metro Area",331748,1060,330022,1296,260473,6848,16631,3701,52918,6414,1726,818
310M100US41660,41660,"San Angelo, TX Metro Area",26302,469,25904,746,17474,1885,1846,1066,6584,1796,398,582
310M100US41700,41700,"San Antonio-New Braunfels, TX Metro Area",578419,2853,576012,3007,380941,11155,42216,5810,152855,10485,2407,1131
310M100US41740,41740,"San Diego-Carlsbad-San Marcos, CA Metro Area",723752,1293,719416,1854,504167,10095,48391,5475,166858,9053,4336,1496
310M100US41780,41780,"Sandusky, OH Metro Area",17052,176,16405,739,9400,1383,2030,1023,4975,1127,647,709
310M100US41860,41860,"San Francisco-Oakland-Fremont, CA Metro Area",919000,1402,914601,2149,670900,10917,60793,7187,182908,10091,4399,1569
310M100US41900,41900,"San Germán-Cabo Rojo, PR Metro Area",33707,1660,33707,1660,18099,2911,2329,1522,13279,2770,0,285
310M100US41940,41940,"San Jose-Sunnyvale-Santa Clara, CA Metro Area",445571,903,444139,1210,345450,7316,28028,4389,70661,5913,1432,818
310M100US41980,41980,"San Juan-Caguas-Guaynabo, PR Metro Area",594477,2141,591849,2419,277709,9374,53428,5788,260712,8773,2628,1056
310M100US42020,42020,"San Luis Obispo-Paso Robles, CA Metro Area",50522,408,49695,812,36494,2239,3544,1207,9657,1953,827,689
310M100US42060,42060,"Santa Barbara-Santa Maria-Goleta, CA Metro Area",96662,1934,96488,1932,70520,4071,7901,2546,18067,3651,174,171
310M100US42100,42100,"Santa Cruz-Watsonville, CA Metro Area",55437,478,55204,502,34990,2999,5359,1926,14855,2894,233,182
310M100US42140,42140,"Santa Fe, NM Metro Area",30617,417,30563,433,15854,2021,3287,1239,11422,2070,54,90
310M100US42220,42220,"Santa Rosa-Petaluma, CA Metro Area",106265,857,105321,1213,75034,3778,10918,2471,19369,3244,944,817
310M100US42340,42340,"Savannah, GA Metro Area",83447,368,82552,768,46237,3490,5353,1914,30962,3554,895,723
310M100US42540,42540,"Scranton--Wilkes-Barre, PA Metro Area",114337,756,113048,1172,69538,3389,9306,2483,34204,3290,1289,785
310M100US42580,42580,"Seaford, DE Micro Area",40697,117,40262,440,23167,2587,5847,1897,11248,1860,435,411
310M100US42620,42620,"Searcy, AR Micro Area",18476,3,18359,203,13467,1554,530,371,4362,1461,117,203
310M100US42660,42660,"Seattle-Tacoma-Bellevue, WA Metro Area",785769,451,778385,2071,569375,8949,52858,5820,156152,9272,7384,2107
310M100US42680,42680,"Sebastian-Vero Beach, FL Metro Area",25910,45,25575,404,15922,2013,3071,1472,6582,1659,335,403
310M100US42700,42700,"Sebring, FL Micro Area",17947,5,17281,942,10085,2189,2921,1871,4275,1285,666,941
310M100US42860,42860,"Seneca, SC Micro Area",15500,646,15285,711,10519,1412,312,327,4454,1426,215,420
310M100US42940,42940,"Sevierville, TN Micro Area",19908,450,19331,804,14825,1673,1056,555,3450,1293,577,652
310M100US43060,43060,"Shawnee, OK Micro Area",17223,234,17223,234,10187,1541,1473,673,5563,1688,0,253
310M100US43100,43100,"Sheboygan, WI Metro Area",27404,460,26725,766,21223,1541,1565,834,3937,1270,679,621
310M100US43140,43140,"Shelby, NC Micro Area",22966,199,22387,673,13385,1726,1762,1382,7240,1453,579,669
310M100US43300,43300,"Sherman-Denison, TX Metro Area",29327,434,28763,622,19166,2010,2857,927,6740,1915,564,535
310M100US43320,43320,"Show Low, AZ Micro Area",31255,1521,31016,1537,20013,2781,2631,1251,8372,2406,239,406
310M100US43340,43340,"Shreveport-Bossier City, LA Metro Area",98538,929,97219,1362,48307,3076,10199,2550,38713,4068,1319,910
