GEO.id,GEO.id2,GEO.display-label,HD01_VD01,HD02_VD01,HD01_VD02,HD02_VD02,HD01_VD03,HD02_VD03,HD01_VD04,HD02_VD04,HD01_VD05,HD02_VD05,HD01_VD06,HD02_VD06
Id,Id2,Geography,Estimate; Total:,Margin of Error; Total:,Estimate; In family households:,Margin of Error; In family households:,Estimate; In family households: - In married-couple family,Margin of Error; In family households: - In married-couple family,"Estimate; In family households: - In male householder, no wife present, family","Margin of Error; In family households: - In male householder, no wife present, family","Estimate; In family households: - In female householder, no husband present, family","Margin of Error; In family households: - In female householder, no husband present, family",Estimate; In nonfamily households,Margin of Error; In nonfamily households
310M100US10140,10140,"Aberdeen, WA Micro Area",15342,296,15302,307,9160,1246,1462,766,4680,1274,40,69
310M100US10180,10180,"Abilene, TX Metro Area",38303,1123,37844,1162,23623,2317,2042,1075,12179,2239,459,403
310M100US10300,10300,"Adrian, MI Micro Area",22991,330,22854,402,14773,1919,1677,925,6404,1587,137,228
310M100US10380,10380,"Aguadilla-Isabela-San Sebastián, PR Metro Area",72500,991,72500,991,40318,3778,5372,1742,26810,3571,0,285
310M100US10420,10420,"Akron, OH Metro Area",155835,1061,155139,1170,106587,3795,8409,2166,40143,3978,696,457
310M100US10500,10500,"Albany, GA Metro Area",41386,1649,41195,1678,19774,2646,2521,1287,18900,2558,191,162
310M100US10540,10540,"Albany-Lebanon, OR Micro Area",28176,423,28018,476,17455,2387,2768,1774,7795,1979,158,214
310M100US10580,10580,"Albany-Schenectady-Troy, NY Metro Area",183224,1716,181162,1982,125774,5069,13684,2751,41704,4188,2062,1116
310M100US10700,10700,"Albertville, AL Micro Area",23877,677,23812,705,16056,1866,1480,894,6276,1795,65,109
310M100US10740,10740,"Albuquerque, NM Metro Area",217741,1369,215683,1630,129866,5699,24927,4363,60890,5874,2058,966
310M100US10780,10780,"Alexandria, LA Metro Area",38476,767,38129,856,22458,2334,1048,712,14623,2087,347,330
310M100US10880,10880,"Allegan, MI Micro Area",29397,312,29397,312,21909,1817,1548,823,5940,1827,0,244
310M100US10900,10900,"Allentown-Bethlehem-Easton, PA-NJ Metro Area",186311,959,185664,1063,127808,4296,10868,2363,46988,4144,647,416
310M100US11020,11020,"Altoona, PA Metro Area",26799,6,26445,374,17949,1649,2628,1102,5868,1365,354,374
310M100US11100,11100,"Amarillo, TX Metro Area",65742,960,64687,1359,44023,3191,4210,1673,16454,2669,1055,849
310M100US11180,11180,"Ames, IA Metro Area",16006,534,16006,534,12608,1116,534,340,2864,1127,0,228
310M100US11260,11260,"Anchorage, AK Metro Area",101428,315,100672,599,71756,3645,6608,2010,22308,3227,756,530
310M100US11300,11300,"Anderson, IN Metro Area",30290,249,28254,1271,15863,2021,3182,1735,9209,2070,2036,1242
310M100US11340,11340,"Anderson, SC Metro Area",44770,206,44589,340,27973,2552,3734,1252,12882,2493,181,279
310M100US11460,11460,"Ann Arbor, MI Metro Area",71253,457,71005,528,53555,2952,3436,1647,14014,2541,248,248
310M100US11500,11500,"Anniston-Oxford, AL Metro Area",26934,259,26889,275,14899,1889,1988,1075,10002,1583,45,79
310M100US11540,11540,"Appleton, WI Metro Area",58001,616,57491,772,43870,2393,4622,1577,8999,1906,510,412
310M100US11700,11700,"Asheville, NC Metro Area",84396,1146,83991,1237,60807,3250,5076,1641,18108,2948,405,437
310M100US11780,11780,"Ashtabula, OH Micro Area",23931,4,23800,153,14951,1507,2838,1216,6011,1420,131,153
310M100US11980,11980,"Athens, TX Micro Area",17731,107,17446,343,11973,1525,1661,1145,3812,1242,285,320
310M100US12020,12020,"Athens-Clarke County, GA Metro Area",40837,1363,40627,1421,26103,2564,2457,1640,12067,2164,210,265
310M100US12060,12060,"Atlanta-Sandy Springs-Marietta, GA Metro Area",1397347,3653,1389435,4572,922351,13777,92195,8842,374889,14292,7912,2352
310M100US12100,12100,"Atlantic City-Hammonton, NJ Metro Area",63744,286,63093,610,39546,2999,5808,1674,17739,2652,651,546
310M100US12180,12180,"Auburn, NY Micro Area",17163,212,16967,264,12254,1071,1456,591,3257,945,196,261
310M100US12220,12220,"Auburn-Opelika, AL Metro Area",31638,27,31417,288,23269,1858,1179,589,6969,1748,221,288
310M100US12260,12260,"Augusta-Richmond County, GA-SC Metro Area",139432,1764,139083,1761,78574,5259,9128,2224,51381,5180,349,380
310M100US12300,12300,"Augusta-Waterville, ME Micro Area",24803,558,24486,589,14937,1588,3229,1065,6320,1606,317,282
310M100US12420,12420,"Austin-Round Rock-San Marcos, TX Metro Area",433592,3924,430966,4210,295974,8270,29731,5018,105261,7317,2626,1589
310M100US12540,12540,"Bakersfield-Delano, CA Metro Area",254556,580,253413,893,154206,7018,26393,4959,72814,5747,1143,682
310M100US12580,12580,"Baltimore-Towson, MD Metro Area",619790,1434,613747,2956,390803,10121,39711,4966,183233,9980,6043,2582
310M100US12620,12620,"Bangor, ME Metro Area",30068,508,29792,568,20575,2094,2155,902,7062,2078,276,241
310M100US12700,12700,"Barnstable Town, MA Metro Area",36711,422,36579,466,23430,2144,2849,1727,10300,2421,132,165
310M100US12940,12940,"Baton Rouge, LA Metro Area",197165,1141,196265,1298,111028,5646,17462,3350,67775,5792,900,662
310M100US12980,12980,"Battle Creek, MI Metro Area",32882,56,32629,233,18552,2060,3716,1354,10361,1618,253,230
310M100US13020,13020,"Bay City, MI Metro Area",23882,250,23779,282,14777,1630,737,437,8265,1586,103,118
310M100US13140,13140,"Beaumont-Port Arthur, TX Metro Area",94882,1361,94420,1411,53689,4155,7171,2092,33560,3862,462,482
310M100US13180,13180,"Beaver Dam, WI Micro Area",19581,349,19404,379,15552,1041,1916,1028,1936,696,177,269
310M100US13220,13220,"Beckley, WV Micro Area",16192,309,16192,309,12417,1200,1519,930,2256,719,0,269
310M100US13380,13380,"Bellingham, WA Metro Area",42249,213,42249,213,30991,1790,2965,1566,8293,1839,0,277
310M100US13460,13460,"Bend, OR Metro Area",35888,691,35697,767,22124,2609,3600,1499,9973,2621,191,272
310M100US13740,13740,"Billings, MT Metro Area",36074,1203,35704,1246,24083,3273,1894,786,9727,2923,370,342
310M100US13780,13780,"Binghamton, NY Metro Area",51411,933,50520,1293,32169,2411,4474,1409,13877,2398,891,895
310M100US13820,13820,"Birmingham-Hoover, AL Metro Area",268601,1561,267492,1749,164783,5850,15986,2603,86723,5207,1109,636
310M100US13900,13900,"Bismarck, ND Metro Area",25030,555,24879,581,19724,1015,1723,701,3432,1062,151,197
310M100US13980,13980,"Blacksburg-Christiansburg-Radford, VA Metro Area",26836,1449,26687,1423,17677,2199,2435,1344,6575,1749,149,283
310M100US14020,14020,"Bloomington, IN Metro Area",35222,921,34879,929,24380,1841,2954,1093,7545,1669,343,277
310M100US14060,14060,"Bloomington-Normal, IL Metro Area",38364,153,38261,189,28987,1557,2452,1272,6822,1668,103,122
310M100US14100,14100,"Bloomsburg-Berwick, PA Micro Area",16605,835,16162,968,10760,1091,1203,588,4199,1419,443,459
310M100US14140,14140,"Bluefield, WV-VA Micro Area",21213,221,21181,230,14909,1309,2030,801,4242,1046,32,61
310M100US14260,14260,"Boise City-Nampa, ID Metro Area",171500,1549,169994,1856,124990,5139,12053,2607,32951,4751,1506,766
310M100US14460,14460,"Boston-Cambridge-Quincy, MA-NH Metro Area",978053,1792,975292,2168,704552,10329,52503,5795,218237,10435,2761,1211
310M100US14500,14500,"Boulder, CO Metro Area",62500,199,62303,336,46564,2355,4060,1520,11679,2336,197,244
310M100US14540,14540,"Bowling Green, KY Metro Area",28530,687,28384,735,19614,1764,1789,936,6981,1517,146,241
310M100US14580,14580,"Bozeman, MT Micro Area",18658,1114,18658,1114,15688,1585,623,544,2347,995,0,237
310M100US14660,14660,"Brainerd, MN Micro Area",20371,447,19730,539,13583,1307,1772,573,4375,1097,641,415
310M100US14700,14700,"Branson, MO Micro Area",18593,897,18507,910,11761,1574,1541,864,5205,1532,86,155
310M100US14740,14740,"Bremerton-Silverdale, WA Metro Area",56602,6,55742,481,40592,2206,3520,1643,11630,1943,860,481
310M100US14860,14860,"Bridgeport-Stamford-Norwalk, CT Metro Area",226361,981,225440,1026,172841,4013,9969,2235,42630,4053,921,501
310M100US15180,15180,"Brownsville-Harlingen, TX Metro Area",134529,451,134303,575,89299,5620,5957,2031,39047,5426,226,367
310M100US15260,15260,"Brunswick, GA Metro Area",24802,1046,24802,1046,14404,2654,1692,1240,8706,2265,0,300
310M100US15380,15380,"Buffalo-Niagara Falls, NY Metro Area",243695,622,241486,1513,146648,5135,20611,3583,74227,5515,2209,1331
310M100US15500,15500,"Burlington, NC Metro Area",36107,583,36012,585,22200,2222,3633,1633,10179,2187,95,114
310M100US15540,15540,"Burlington-South Burlington, VT Metro Area",43409,520,42976,574,31630,1744,3086,1034,8260,1582,433,338
310M100US15940,15940,"Canton-Massillon, OH Metro Area",90586,1014,89490,1270,58639,2909,7661,1944,23190,2864,1096,789
310M100US15980,15980,"Cape Coral-Fort Myers, FL Metro Area",121065,958,120330,1201,71390,4853,13599,3263,35341,4580,735,844
310M100US16020,16020,"Cape Girardeau-Jackson, MO-IL Metro Area",22608,1449,22319,1486,14820,1755,1404,834,6095,1320,289,320
310M100US16180,16180,"Carson City, NV Metro Area",12035,198,11491,700,6709,1249,1573,973,3209,1267,544,652
310M100US16220,16220,"Casper, WY Metro Area",17833,245,17683,331,11696,1443,1341,847,4646,1509,150,186
310M100US16300,16300,"Cedar Rapids, IA Metro Area",62774,318,62283,472,44907,2671,5817,1735,11559,2256,491,402
310M100US16500,16500,"Centralia, WA Micro Area",17595,303,17426,406,13012,1099,1235,750,3179,1110,169,241
310M100US16540,16540,"Chambersburg, PA Micro Area",35621,170,35293,469,27226,1964,1770,733,6297,1742,328,462
310M100US16580,16580,"Champaign-Urbana, IL Metro Area",46356,1491,45905,1538,29556,2074,3632,1276,12717,1536,451,395
310M100US16620,16620,"Charleston, WV Metro Area",64949,1164,64055,1529,43577,2886,6024,1878,14454,2218,894,977
310M100US16700,16700,"Charleston-North Charleston-Summerville, SC Metro Area",153186,1290,152748,1367,96884,4728,8535,2383,47329,4391,438,516
310M100US16740,16740,"Charlotte-Gastonia-Rock Hill, NC-SC Metro Area",455249,1236,451286,2263,304163,7075,33806,4367,113317,7637,3963,1941
310M100US16820,16820,"Charlottesville, VA Metro Area",40110,2276,40110,2276,28432,2280,2472,947,9206,2121,0,287
310M100US16860,16860,"Chattanooga, TN-GA Metro Area",119048,2709,117953,2812,77796,3647,9844,2235,30313,2928,1095,861
310M100US16940,16940,"Cheyenne, WY Metro Area",22338,764,22338,764,13716,1954,2253,1077,6369,2085,0,269
310M100US16980,16980,"Chicago-Joliet-Naperville, IL-IN-WI Metro Area",2373876,2037,2364505,2730,1621470,17556,158176,10941,584859,15595,9371,1809
310M100US17020,17020,"Chico, CA Metro Area",44901,951,44727,987,28283,2784,4797,1902,11647,2630,174,216
310M100US17060,17060,"Chillicothe, OH Micro Area",17529,170,17433,180,11100,1393,1074,565,5259,1292,96,156
310M100US17140,17140,"Cincinnati-Middletown, OH-KY-IN Metro Area",529456,2040,526458,2403,363002,7453,34516,4292,128940,5776,2998,1393
310M100US17220,17220,"Clarksburg, WV Micro Area",20448,1623,20297,1657,14505,2112,430,292,5362,1656,151,157
310M100US17300,17300,"Clarksville, TN-KY Metro Area",71839,1944,71266,2057,43988,4160,3800,1173,23478,3960,573,633
310M100US17340,17340,"Clearlake, CA Micro Area",13310,499,13310,499,9684,1491,663,689,2963,1348,0,294
310M100US17420,17420,"Cleveland, TN Metro Area",26206,1043,26033,1052,17446,1867,2699,1469,5888,1497,173,232
310M100US17460,17460,"Cleveland-Elyria-Mentor, OH Metro Area",476176,2435,473382,2732,290422,7756,30501,4596,152459,7684,2794,1123
310M100US17620,17620,"Coamo, PR Micro Area",19070,841,19070,841,8660,1646,2236,1056,8174,1655,0,285
310M100US17660,17660,"Coeur d'Alene, ID Metro Area",34318,427,33770,609,23722,2148,1514,795,8534,1925,548,519
310M100US17780,17780,"College Station-Bryan, TX Metro Area",48582,1563,48198,1603,29784,2882,4419,2162,13995,3032,384,390
310M100US17820,17820,"Colorado Springs, CO Metro Area",166848,1594,165451,1883,119197,4570,7999,2085,38255,4314,1397,890
310M100US17860,17860,"Columbia, MO Metro Area",36627,916,36538,923,25570,1881,2685,1122,8283,1515,89,148
310M100US17900,17900,"Columbia, SC Metro Area",178262,1746,176648,2091,105528,5208,11203,2967,59917,5042,1614,1030
310M100US17940,17940,"Columbia, TN Micro Area",19076,923,19076,923,13733,1649,799,740,4544,1432,0,287
310M100US17980,17980,"Columbus, GA-AL Metro Area",74239,2558,73404,2640,37096,3415,3845,1315,32463,3054,835,1003
310M100US18020,18020,"Columbus, IN Metro Area",19351,4,19351,4,13117,1861,876,678,5358,1839,0,267
310M100US18140,18140,"Columbus, OH Metro Area",454223,737,451516,1541,297006,7664,30952,4395,123558,7512,2707,1262
310M100US18180,18180,"Concord, NH Micro Area",31566,330,30950,586,21896,2147,2689,1224,6365,1876,616,395
310M100US18260,18260,"Cookeville, TN Micro Area",21897,1573,21468,1516,16193,1990,267,232,5008,1339,429,394
310M100US18300,18300,"Coos Bay, OR Micro Area",12020,805,11307,848,7659,1226,968,590,2680,1319,713,584
310M100US18500,18500,"Corning, NY Micro Area",22862,165,22187,536,16832,1115,1295,561,4060,978,675,533
310M100US18580,18580,"Corpus Christi, TX Metro Area",113249,1183,112907,1243,64309,4632,11068,2984,37530,3528,342,397
310M100US18700,18700,"Corvallis, OR Metro Area",15315,573,15190,656,12206,988,596,358,2388,937,125,214
310M100US18880,18880,"Crestview-Fort Walton Beach-Destin, FL Metro Area",39798,592,39578,642,26775,2545,2909,1521,9894,2226,220,250
310M100US18980,18980,"Cullman, AL Micro Area",19207,457,18790,541,13731,1621,366,353,4693,1543,417,395
310M100US19060,19060,"Cumberland, MD-WV Metro Area",18905,663,18419,932,11815,1245,724,367,5880,1293,486,542
310M100US19100,19100,"Dallas-Fort Worth-Arlington, TX Metro Area",1776496,2079,1769004,3605,1201070,15105,120696,8928,447238,14834,7492,2854
310M100US19140,19140,"Dalton, GA Metro Area",39667,292,38748,1044,27223,2822,4275,1980,7250,1851,919,1042
310M100US19180,19180,"Danville, IL Metro Area",19845,5,19845,5,10182,1311,2296,987,7367,1321,0,267
310M100US19260,19260,"Danville, VA Metro Area",21631,964,21432,992,12388,1354,1357,624,7687,1361,199,163
310M100US19300,19300,"Daphne-Fairhope-Foley, AL Micro Area",42139,458,41865,592,28373,2688,2850,1410,10642,2476,274,417
310M100US19340,19340,"Davenport-Moline-Rock Island, IA-IL Metro Area",89347,1263,88638,1395,58286,2867,6182,1427,24170,2436,709,521
310M100US19380,19380,"Dayton, OH Metro Area",192076,891,190893,1204,119011,4761,15225,2834,56657,4579,1183,714
310M100US19460,19460,"Decatur, AL Metro Area",36503,582,36503,582,25843,1865,1744,993,8916,1483,0,273
310M100US19500,19500,"Decatur, IL Metro Area",25085,494,25085,494,14466,1690,2900,1214,7719,1476,0,267
310M100US19660,19660,"Deltona-Daytona Beach-Ormond Beach, FL Metro Area",92064,1265,91560,1349,57269,4252,7218,1732,27073,3911,504,440
310M100US19740,19740,"Denver-Aurora-Broomfield, CO Metro Area",633946,1708,630838,2171,441578,8837,54770,6024,134490,7364,3108,1325
310M100US19780,19780,"Des Moines-West Des Moines, IA Metro Area",147798,1404,147314,1416,102923,4122,10331,2136,34060,3930,484,379
310M100US19820,19820,"Detroit-Warren-Livonia, MI Metro Area",1038964,1137,1031031,2883,672441,11610,68879,6962,289711,10289,7933,2469
310M100US20020,20020,"Dothan, AL Metro Area",34210,882,33881,914,19338,1764,2702,994,11841,1577,329,264
310M100US20100,20100,"Dover, DE Metro Area",40525,365,40406,392,23928,2682,3197,1421,13281,2159,119,147
310M100US20180,20180,"DuBois, PA Micro Area",16328,58,16201,133,12115,1095,1228,539,2858,1032,127,121
310M100US20220,20220,"Dubuque, IA Metro Area",22280,7,21954,331,16918,1132,1209,513,3827,1072,326,332
310M100US20260,20260,"Duluth, MN-WI Metro Area",56304,1298,55502,1389,35477,2161,5901,1445,14124,2129,802,577
310M100US20380,20380,"Dunn, NC Micro Area",32169,365,32169,365,21263,2258,2126,1150,8780,2092,0,289
310M100US20500,20500,"Durham-Chapel Hill, NC Metro Area",110314,719,109922,908,70784,4228,7844,1838,31294,3549,392,411
310M100US20620,20620,"East Liverpool-Salem, OH Micro Area",23044,593,22990,619,16161,1709,1565,808,5264,1717,54,91
310M100US20700,20700,"East Stroudsburg, PA Micro Area",39424,1602,39147,1645,27861,2576,2613,1292,8673,1955,277,401
310M100US20740,20740,"Eau Claire, WI Metro Area",35236,1149,34749,1038,25441,1550,1789,694,7519,1332,487,426
310M100US20940,20940,"El Centro, CA Metro Area",50875,647,50842,662,32659,2744,4532,1832,13651,3133,33,59
310M100US21060,21060,"Elizabethtown, KY Metro Area",29783,1791,29030,2065,20096,2318,1508,944,7426,1754,753,981
310M100US21140,21140,"Elkhart-Goshen, IN Metro Area",55836,675,55293,736,37865,2996,3621,2293,13807,2601,543,428
310M100US21300,21300,"Elmira, NY Metro Area",19735,140,18997,1038,12670,1337,1891,730,4436,1058,738,1040
310M100US21340,21340,"El Paso, TX Metro Area",240858,475,240304,745,149833,7266,15033,3128,75438,6718,554,560
310M100US21460,21460,"Enterprise-Ozark, AL Micro Area",24910,584,24623,626,13481,2005,1919,977,9223,1691,287,426
310M100US21500,21500,"Erie, PA Metro Area",62958,629,61428,1545,36434,2515,6450,2025,18544,2374,1530,1409
310M100US21660,21660,"Eugene-Springfield, OR Metro Area",69326,304,68234,851,43770,3052,6802,1822,17662,2991,1092,783
310M100US21700,21700,"Eureka-Arcata-Fortuna, CA Micro Area",27099,414,26675,547,14477,2430,3125,966,9073,2472,424,352
310M100US21780,21780,"Evansville, IN-KY Metro Area",82453,976,81119,1190,51885,3074,7101,1983,22133,2718,1334,730
310M100US21820,21820,"Fairbanks, AK Metro Area",25322,151,25322,151,19052,1931,1662,1075,4608,1617,0,246
310M100US21940,21940,"Fajardo, PR Metro Area",17289,740,17174,748,5730,1460,2255,1090,9189,1517,115,165
310M100US22020,22020,"Fargo, ND-MN Metro Area",46867,921,46789,930,36075,2118,1818,792,8896,2044,78,128
310M100US22100,22100,"Farmington, MO Micro Area",14070,902,13696,977,10739,1550,628,433,2329,1189,374,375
310M100US22140,22140,"Farmington, NM Metro Area",36627,563,36365,641,19190,2804,6700,2022,10475,2852,262,396
310M100US22180,22180,"Fayetteville, NC Metro Area",100103,727,98306,1414,55256,3691,7382,2140,35668,3694,1797,1215
310M100US22220,22220,"Fayetteville-Springdale-Rogers, AR-MO Metro Area",123875,1498,123563,1554,88263,4331,7761,2435,27539,3851,312,325
310M100US22300,22300,"Findlay, OH Micro Area",17548,105,17470,144,10614,1585,2473,1104,4383,1526,78,127
310M100US22380,22380,"Flagstaff, AZ Metro Area",31345,378,31345,378,18039,1962,3433,1337,9873,1973,0,305
310M100US22420,22420,"Flint, MI Metro Area",103884,1205,102590,1443,60046,3129,7613,2096,34931,2747,1294,806
310M100US22500,22500,"Florence, SC Metro Area",50384,151,50139,350,22794,3120,5125,2285,22220,3002,245,318
310M100US22520,22520,"Florence-Muscle Shoals, AL Metro Area",32229,595,31914,684,19367,2271,2863,1533,9684,1961,315,394
310M100US22540,22540,"Fond du Lac, WI Metro Area",23067,245,22695,360,16180,1449,1860,730,4655,1321,372,267
310M100US22580,22580,"Forest City, NC Micro Area",14995,199,14880,250,10742,1431,647,509,3491,1311,115,145
310M100US22660,22660,"Fort Collins-Loveland, CO Metro Area",63899,347,63823,377,48472,2713,3593,1345,11758,2505,76,126
310M100US22840,22840,"Fort Payne, AL Micro Area",18544,461,18402,499,11527,2239,2648,1546,4227,1750,142,212
310M100US22900,22900,"Fort Smith, AR-OK Metro Area",77082,1609,76846,1639,50636,3429,6299,1552,19911,2994,236,294
310M100US23060,23060,"Fort Wayne, IN Metro Area",110371,1373,109245,1537,74515,3822,5319,1468,29411,3417,1126,851
310M100US23180,23180,"Frankfort, KY Micro Area",16394,1021,16081,1103,10280,1380,2697,1220,3104,1150,313,301
310M100US23420,23420,"Fresno, CA Metro Area",277686,1187,276736,1334,177829,7122,27564,4046,71343,6821,950,649
310M100US23460,23460,"Gadsden, AL Metro Area",23809,270,23332,835,14693,1623,1455,1013,7184,1618,477,660
310M100US23540,23540,"Gainesville, FL Metro Area",46923,1154,46749,1138,29503,2546,2365,1120,14881,2453,174,204
310M100US23580,23580,"Gainesville, GA Metro Area",49979,252,49419,616,33752,3425,6368,1941,9299,2844,560,592
310M100US23660,23660,"Galesburg, IL Micro Area",13640,1226,13508,1209,7053,1428,1175,636,5280,1464,132,221
310M100US23700,23700,"Gallup, NM Micro Area",22485,311,22485,311,11864,2166,2620,1270,8001,2066,0,285
310M100US23900,23900,"Gettysburg, PA Micro Area",22426,8,22132,276,14715,1237,1159,507,6258,1177,294,276
310M100US24020,24020,"Glens Falls, NY Metro Area",26089,461,26073,463,19879,1388,1506,728,4688,1354,16,28
310M100US24140,24140,"Goldsboro, NC Metro Area",30122,346,29903,451,18332,1745,1638,738,9933,1725,219,272
310M100US24220,24220,"Grand Forks, ND-MN Metro Area",20624,927,20422,949,15030,1449,849,494,4543,1370,202,236
310M100US24260,24260,"Grand Island, NE Micro Area",19665,1018,19301,1053,12360,1661,2746,1228,4195,1386,364,352
310M100US24300,24300,"Grand Junction, CO Metro Area",34174,484,34174,484,23219,3067,4280,1929,6675,2429,0,279
310M100US24340,24340,"Grand Rapids-Wyoming, MI Metro Area",199407,479,197474,959,134286,5317,14081,2736,49107,4846,1933,995
310M100US24420,24420,"Grants Pass, OR Micro Area",17020,330,16599,704,10016,2116,3500,1889,3083,1385,421,604
310M100US24500,24500,"Great Falls, MT Metro Area",18470,525,18349,565,13906,1252,910,618,3533,1291,121,192
310M100US24540,24540,"Greeley, CO Metro Area",70496,310,70332,410,54178,2934,3745,1409,12409,2746,164,267
310M100US24580,24580,"Green Bay, WI Metro Area",74956,229,74648,339,53603,2477,4720,1220,16325,2632,308,250
310M100US24620,24620,"Greeneville, TN Micro Area",14165,1185,14165,1185,8250,1574,2138,1468,3777,1706,0,287
310M100US24660,24660,"Greensboro-High Point, NC Metro Area",169340,283,167866,946,100904,4654,12578,2623,54384,4673,1474,932
310M100US24780,24780,"Greenville, NC Metro Area",42573,869,42573,869,25276,2244,2267,1307,15030,2327,0,289
310M100US24860,24860,"Greenville-Mauldin-Easley, SC Metro Area",148746,1023,147348,1558,97156,4748,9716,2744,40476,4344,1398,1133
310M100US24940,24940,"Greenwood, SC Micro Area",16475,4,16388,155,8345,1124,1435,797,6608,1304,87,156
310M100US25020,25020,"Guayama, PR Metro Area",19986,1424,19986,1424,9422,1782,2436,972,8128,1771,0,285
310M100US25060,25060,"Gulfport-Biloxi, MS Metro Area",60505,1714,60160,1744,37575,3603,3563,1440,19022,3280,345,365
310M100US25180,25180,"Hagerstown-Martinsburg, MD-WV Metro Area",62621,1309,61949,1489,39175,3103,5361,1868,17413,2926,672,512
310M100US25220,25220,"Hammond, LA Micro Area",30625,503,29995,1209,16404,2152,2672,1179,10919,1821,630,944
310M100US25260,25260,"Hanford-Corcoran, CA Metro Area",42558,15,42558,15,30400,2039,4991,1836,7167,1857,0,294
310M100US25420,25420,"Harrisburg-Carlisle, PA Metro Area",120534,777,120054,828,75691,3613,10979,2641,33384,3178,480,312
310M100US25500,25500,"Harrisonburg, VA Metro Area",24929,716,24340,748,18398,1644,2005,1213,3937,1548,589,627
310M100US25540,25540,"Hartford-West Hartford-East Hartford, CT Metro Area",268842,540,268475,639,174634,5815,16846,2926,76995,5377,367,357
310M100US25620,25620,"Hattiesburg, MS Metro Area",35990,760,35861,777,21987,2125,3678,1654,10196,1741,129,192
310M100US25740,25740,"Helena, MT Micro Area",14835,1384,14316,1444,10404,1664,1110,652,2802,1030,519,703
310M100US25860,25860,"Hickory-Lenoir-Morganton, NC Metro Area",84371,1049,83259,1283,56380,3426,5558,1637,21321,3049,1112,780
310M100US25900,25900,"Hilo, HI Micro Area",41734,260,41206,536,27075,2559,2849,1011,11282,2585,528,454
310M100US25940,25940,"Hilton Head Island-Beaufort, SC Micro Area",40265,1178,39941,1304,25943,2869,3474,1649,10524,2593,324,441
310M100US25980,25980,"Hinesville-Fort Stewart, GA Metro Area",22337,1689,22337,1689,12335,2351,1030,856,8972,2013,0,300
310M100US26100,26100,"Holland-Grand Haven, MI Metro Area",68469,143,67132,1385,51053,3000,5215,2045,10864,2140,1337,1376
310M100US26140,26140,"Homosassa Springs, FL Micro Area",22556,505,22072,742,13491,1214,2354,1178,6227,1135,484,507
310M100US26180,26180,"Honolulu, HI Metro Area",209730,587,208549,790,151414,5908,12855,2719,44280,4893,1181,609
310M100US26300,26300,"Hot Springs, AR Metro Area",20392,321,20019,546,13699,1664,1555,912,4765,1567,373,379
310M100US26380,26380,"Houma-Bayou Cane-Thibodaux, LA Metro Area",52363,537,51547,780,29847,2197,5782,2339,15918,2149,816,645
310M100US26420,26420,"Houston-Sugar Land-Baytown, TX Metro Area",1665529,2165,1654620,3838,1119597,18285,117251,10267,417772,16976,10909,3156
310M100US26580,26580,"Huntington-Ashland, WV-KY-OH Metro Area",61787,962,60659,905,36336,2921,3700,1368,20623,3088,1128,768
310M100US26620,26620,"Huntsville, AL Metro Area",99627,307,98506,891,68498,3372,7938,2254,22070,2924,1121,838
310M100US26660,26660,"Huntsville, TX Micro Area",11394,11,11194,317,7793,1000,702,757,2699,1046,200,317
310M100US26740,26740,"Hutchinson, KS Micro Area",15312,1110,15108,1158,9168,1497,1183,1177,4757,1412,204,338
310M100US26820,26820,"Idaho Falls, ID Metro Area",42576,1033,42576,1033,33451,2397,1527,869,7598,1939,0,267
310M100US26860,26860,"Indiana, PA Micro Area",16638,190,16622,195,11650,1476,1540,953,3432,1254,16,27
310M100US26900,26900,"Indianapolis-Carmel, IN Metro Area",456208,1975,452314,2362,291210,8699,30587,3760,130517,7204,3894,1683
310M100US26980,26980,"Iowa City, IA Metro Area",30525,762,30213,842,23291,1678,1651,728,5271,1485,312,363
310M100US27060,27060,"Ithaca, NY Metro Area",14782,1165,14691,1182,9973,1728,1782,1336,2936,1217,91,141
310M100US27100,27100,"Jackson, MI Metro Area",36866,245,36552,460,20563,2083,2800,1177,13189,1936,314,357
310M100US27140,27140,"Jackson, MS Metro Area",140008,2035,139597,2094,75059,4741,9485,2594,55053,4347,411,485
310M100US27180,27180,"Jackson, TN Metro Area",27205,1169,27205,1169,14182,2468,1455,920,11568,2452,0,287
310M100US27260,27260,"Jacksonville, FL Metro Area",319781,1656,317828,2129,198355,7364,21479,3427,97994,7168,1953,1162
310M100US27340,27340,"Jacksonville, NC Metro Area",45352,589,44816,689,29101,2882,1803,925,13912,2689,536,410
310M100US27460,27460,"Jamestown-Dunkirk-Fredonia, NY Micro Area",29388,348,29259,366,19496,1870,2169,995,7594,1946,129,115
