310M100US43420,43420,"Sierra Vista-Douglas, AZ Micro Area",30398,627,30309,619,19649,1892,1981,969,8679,2088,89,110
310M100US43580,43580,"Sioux City, IA-NE-SD Metro Area",38348,969,38282,985,26212,2162,3458,1163,8612,1808,66,111
310M100US43620,43620,"Sioux Falls, SD Metro Area",59172,1179,58897,1222,42896,2348,4189,1382,11812,2267,275,279
310M100US43740,43740,"Somerset, PA Micro Area",15047,4,14949,97,11128,1141,655,319,3166,1222,98,97
310M100US43780,43780,"South Bend-Mishawaka, IN-MI Metro Area",77049,818,76106,1320,48826,3237,5016,1634,22264,2690,943,1050
310M100US43860,43860,"Southern Pines-Pinehurst, NC Micro Area",19212,278,19212,278,12114,1349,1175,974,5923,1206,0,289
310M100US43900,43900,"Spartanburg, SC Metro Area",69326,428,68984,583,46443,2719,2909,1304,19632,2564,342,410
310M100US44060,44060,"Spokane, WA Metro Area",108675,611,108351,662,77703,3671,6720,2148,23928,3533,324,206
310M100US44100,44100,"Springfield, IL Metro Area",49949,719,49505,842,29852,2565,6069,1894,13584,2222,444,436
310M100US44140,44140,"Springfield, MA Metro Area",149936,420,148134,931,86404,4735,10161,2227,51569,4120,1802,848
310M100US44180,44180,"Springfield, MO Metro Area",100532,1275,98683,1992,71034,3867,8763,2249,18886,3249,1849,1555
310M100US44220,44220,"Springfield, OH Metro Area",32586,70,31985,509,17714,2008,2377,1362,11894,1879,601,488
310M100US44300,44300,"State College, PA Metro Area",24223,555,24174,562,18047,1675,1187,841,4940,1454,49,84
310M100US44340,44340,"Statesboro, GA Micro Area",14625,309,14407,378,8468,1592,568,375,5371,1698,218,253
310M100US44380,44380,"Statesville-Mooresville, NC Micro Area",40391,322,40391,322,29942,2112,1391,733,9058,1962,0,289
310M100US44420,44420,"Staunton-Waynesboro, VA Micro Area",24608,1750,24608,1750,17190,2139,1551,1077,5867,1746,0,287
310M100US44600,44600,"Steubenville-Weirton, OH-WV Metro Area",24519,155,24519,155,14440,1698,2684,1089,7395,1466,0,273
310M100US44620,44620,"Stevens Point, WI Micro Area",14485,63,14442,84,10917,829,930,507,2595,794,43,55
310M100US44660,44660,"Stillwater, OK Micro Area",14297,611,14176,660,11033,1279,467,334,2676,1177,121,183
310M100US44700,44700,"Stockton, CA Metro Area",200615,641,199594,981,126595,5724,20002,4016,52997,6026,1021,840
310M100US44940,44940,"Sumter, SC Metro Area",28365,569,28298,557,15650,2377,2337,1340,10311,1962,67,126
310M100US44980,44980,"Sunbury, PA Micro Area",19665,677,19230,813,13676,1391,1560,842,3994,1217,435,368
310M100US45060,45060,"Syracuse, NY Metro Area",150776,790,149872,940,97121,4147,8410,2231,44341,3965,904,515
310M100US45180,45180,"Talladega-Sylacauga, AL Micro Area",19066,223,19066,223,11223,1607,2018,1057,5825,1407,0,273
310M100US45220,45220,"Tallahassee, FL Metro Area",73187,1376,73092,1365,46405,3777,3574,1939,23113,3164,95,165
310M100US45300,45300,"Tampa-St. Petersburg-Clearwater, FL Metro Area",587500,1428,582453,1915,361186,8542,48993,6202,172274,8721,5047,1550
310M100US45460,45460,"Terre Haute, IN Metro Area",38856,1206,38675,1190,26206,1920,3812,1391,8657,1678,181,160
310M100US45500,45500,"Texarkana, TX-Texarkana, AR Metro Area",32839,303,32672,452,17980,2161,3472,1820,11220,2399,167,260
310M100US45540,45540,"The Villages, FL Micro Area",8510,85,8217,301,5559,1134,559,516,2099,920,293,289
310M100US45640,45640,"Thomasville-Lexington, NC Micro Area",38650,489,38388,560,25944,2319,2308,1050,10136,2266,262,272
310M100US45780,45780,"Toledo, OH Metro Area",152490,572,151401,841,91916,4294,11529,2432,47956,3978,1089,612
310M100US45820,45820,"Topeka, KS Metro Area",60183,1192,59615,1321,36429,2559,6521,2133,16665,2755,568,472
310M100US45860,45860,"Torrington, CT Micro Area",40734,173,40577,258,30888,1978,2754,1072,6935,1746,157,203
310M100US45900,45900,"Traverse City, MI Micro Area",30774,1270,30585,1333,21661,1868,2170,976,6754,1730,189,238
310M100US45940,45940,"Trenton-Ewing, NJ Metro Area",82873,35,82763,145,57518,3562,5280,1799,19965,3179,110,138
310M100US46020,46020,"Truckee-Grass Valley, CA Micro Area",19256,882,19133,932,12680,1561,3080,1409,3373,1260,123,176
310M100US46060,46060,"Tucson, AZ Metro Area",224447,777,221303,1767,136940,6804,17825,3374,66538,6735,3144,1877
310M100US46100,46100,"Tullahoma, TN Micro Area",24222,976,23759,742,16212,1998,1757,936,5790,1799,463,734
310M100US46140,46140,"Tulsa, OK Metro Area",237777,1486,236578,1649,156707,4712,18603,3112,61268,5085,1199,667
310M100US46180,46180,"Tupelo, MS Micro Area",33705,1343,33574,1323,21459,2406,1784,849,10331,1794,131,209
310M100US46220,46220,"Tuscaloosa, AL Metro Area",48111,1320,46976,1646,30943,1993,2253,1320,13780,2170,1135,937
310M100US46300,46300,"Twin Falls, ID Micro Area",28139,1521,27730,1644,20964,1835,1671,833,5095,1493,409,609
310M100US46340,46340,"Tyler, TX Metro Area",54106,540,53462,1064,35048,2667,2010,1031,16404,2795,644,839
310M100US46380,46380,"Ukiah, CA Micro Area",18723,515,18523,572,11579,1699,1582,787,5362,1600,200,260
310M100US46540,46540,"Utica-Rome, NY Metro Area",65422,624,65045,697,46875,2375,2982,819,15188,2160,377,340
310M100US46660,46660,"Valdosta, GA Metro Area",33798,1031,33524,1087,19490,2573,2624,1338,11410,2579,274,316
310M100US46700,46700,"Vallejo-Fairfield, CA Metro Area",100874,815,99842,891,62505,4018,8788,2423,28549,3503,1032,707
310M100US47020,47020,"Victoria, TX Metro Area",30831,1250,30831,1250,17831,2316,2088,883,10912,2275,0,294
310M100US47220,47220,"Vineland-Millville-Bridgeton, NJ Metro Area",36981,929,36723,887,18971,2606,5237,2119,12515,2545,258,255
310M100US47260,47260,"Virginia Beach-Norfolk-Newport News, VA-NC Metro Area",393097,2293,391016,2546,255288,8382,19764,3016,115964,7950,2081,866
310M100US47300,47300,"Visalia-Porterville, CA Metro Area",144355,214,144043,355,95057,4457,12273,2808,36713,4521,312,284
310M100US47380,47380,"Waco, TX Metro Area",59531,549,59268,643,34159,2996,3773,1789,21336,3000,263,305
310M100US47580,47580,"Warner Robins, GA Metro Area",37520,244,37245,391,22350,2421,3222,1383,11673,2180,275,262
310M100US47700,47700,"Warsaw, IN Micro Area",19829,128,19593,368,15412,1336,1510,1033,2671,1016,236,349
310M100US47900,47900,"Washington-Arlington-Alexandria, DC-VA-MD-WV Metro Area",1332579,1602,1327293,2087,930832,13656,96753,8401,299708,11671,5286,1652
310M100US47940,47940,"Waterloo-Cedar Falls, IA Metro Area",35905,1304,35676,1324,22346,2126,2140,1110,11190,1903,229,271
310M100US48020,48020,"Watertown-Fort Atkinson, WI Micro Area",19795,138,19733,167,14073,1195,1024,692,4636,1270,62,90
310M100US48060,48060,"Watertown-Fort Drum, NY Micro Area",29573,325,29375,409,21185,1816,1470,811,6720,1724,198,195
310M100US48140,48140,"Wausau, WI Metro Area",32796,293,31824,939,23963,2128,1451,807,6410,1762,972,877
310M100US48300,48300,"Wenatchee-East Wenatchee, WA Metro Area",28560,291,28314,346,19569,2071,2740,1315,6005,1791,246,219
310M100US48540,48540,"Wheeling, WV-OH Metro Area",28893,213,28486,422,19094,1598,2205,801,7187,1606,407,353
310M100US48580,48580,"Whitewater, WI Micro Area",24059,337,24007,334,16292,1642,2618,975,5097,1520,52,83
310M100US48620,48620,"Wichita, KS Metro Area",167862,1259,167095,1513,116697,4677,11261,2601,39137,4248,767,676
310M100US48660,48660,"Wichita Falls, TX Metro Area",35621,1276,35471,1368,22297,2700,2071,996,11103,2249,150,241
310M100US48700,48700,"Williamsport, PA Metro Area",24277,401,24097,460,13498,1745,2405,954,8194,2058,180,204
310M100US48740,48740,"Willimantic, CT Micro Area",26375,125,26218,216,17482,1811,2920,1391,5816,1591,157,204
310M100US48900,48900,"Wilmington, NC Metro Area",72601,495,72375,554,44172,3303,6024,2145,22179,3265,226,235
310M100US48980,48980,"Wilson, NC Micro Area",20009,61,19958,104,11052,1693,2709,1307,6197,1603,51,83
310M100US49020,49020,"Winchester, VA-WV Metro Area",31426,1518,30736,1675,21111,2043,1652,730,7973,1775,690,614
310M100US49180,49180,"Winston-Salem, NC Metro Area",113935,607,113800,643,71101,4730,9868,2248,32831,4054,135,175
310M100US49300,49300,"Wooster, OH Micro Area",28929,618,28929,618,20805,2083,1673,895,6451,1978,0,269
310M100US49340,49340,"Worcester, MA Metro Area",186930,249,185139,1034,134471,5311,9843,2367,40825,4555,1791,951
310M100US49420,49420,"Yakima, WA Metro Area",74515,650,74160,809,42288,4173,8309,2874,23563,4197,355,456
310M100US49500,49500,"Yauco, PR Metro Area",26219,1070,25978,1043,13832,1785,2561,1034,9585,1780,241,381
310M100US49620,49620,"York-Hanover, PA Metro Area",101558,400,99906,977,71130,3320,6043,1662,22733,2990,1652,892
310M100US49660,49660,"Youngstown-Warren-Boardman, OH-PA Metro Area",122218,842,121745,891,75518,3944,7281,1824,38946,4089,473,360
310M100US49700,49700,"Yuba City, CA Metro Area",45450,1662,45214,1640,32600,2513,3736,1296,8878,2214,236,350
310M100US49740,49740,"Yuma, AZ Metro Area",55201,196,55201,196,36669,3542,7789,2374,10743,2853,0,305
310M100US49780,49780,"Zanesville, OH Micro Area",20556,218,20307,265,13227,1720,1048,806,6032,1585,249,235
