GEO.id,GEO.id2,GEO.display-label,HC01_EST_VC01,HC01_MOE_VC01,HC02_EST_VC01,HC02_MOE_VC01,HC03_EST_VC01,HC03_MOE_VC01,HC01_EST_VC03,HC01_MOE_VC03,HC02_EST_VC03,HC02_MOE_VC03,HC03_EST_VC03,HC03_MOE_VC03,HC01_EST_VC04,HC01_MOE_VC04,HC02_EST_VC04,HC02_MOE_VC04,HC03_EST_VC04,HC03_MOE_VC04,HC01_EST_VC05,HC01_MOE_VC05,HC02_EST_VC05,HC02_MOE_VC05,HC03_EST_VC05,HC03_MOE_VC05,HC01_EST_VC06,HC01_MOE_VC06,HC02_EST_VC06,HC02_MOE_VC06,HC03_EST_VC06,HC03_MOE_VC06,HC01_EST_VC07,HC01_MOE_VC07,HC02_EST_VC07,HC02_MOE_VC07,HC03_EST_VC07,HC03_MOE_VC07,HC01_EST_VC08,HC01_MOE_VC08,HC02_EST_VC08,HC02_MOE_VC08,HC03_EST_VC08,HC03_MOE_VC08,HC01_EST_VC09,HC01_MOE_VC09,HC02_EST_VC09,HC02_MOE_VC09,HC03_EST_VC09,HC03_MOE_VC09,HC01_EST_VC10,HC01_MOE_VC10,HC02_EST_VC10,HC02_MOE_VC10,HC03_EST_VC10,HC03_MOE_VC10,HC01_EST_VC11,HC01_MOE_VC11,HC02_EST_VC11,HC02_MOE_VC11,HC03_EST_VC11,HC03_MOE_VC11,HC01_EST_VC12,HC01_MOE_VC12,HC02_EST_VC12,HC02_MOE_VC12,HC03_EST_VC12,HC03_MOE_VC12,HC01_EST_VC13,HC01_MOE_VC13,HC02_EST_VC13,HC02_MOE_VC13,HC03_EST_VC13,HC03_MOE_VC13,HC01_EST_VC14,HC01_MOE_VC14,HC02_EST_VC14,HC02_MOE_VC14,HC03_EST_VC14,HC03_MOE_VC14,HC01_EST_VC15,HC01_MOE_VC15,HC02_EST_VC15,HC02_MOE_VC15,HC03_EST_VC15,HC03_MOE_VC15,HC01_EST_VC16,HC01_MOE_VC16,HC02_EST_VC16,HC02_MOE_VC16,HC03_EST_VC16,HC03_MOE_VC16,HC01_EST_VC17,HC01_MOE_VC17,HC02_EST_VC17,HC02_MOE_VC17,HC03_EST_VC17,HC03_MOE_VC17,HC01_EST_VC18,HC01_MOE_VC18,HC02_EST_VC18,HC02_MOE_VC18,HC03_EST_VC18,HC03_MOE_VC18,HC01_EST_VC19,HC01_MOE_VC19,HC02_EST_VC19,HC02_MOE_VC19,HC03_EST_VC19,HC03_MOE_VC19,HC01_EST_VC20,HC01_MOE_VC20,HC02_EST_VC20,HC02_MOE_VC20,HC03_EST_VC20,HC03_MOE_VC20,HC01_EST_VC23,HC01_MOE_VC23,HC02_EST_VC23,HC02_MOE_VC23,HC03_EST_VC23,HC03_MOE_VC23,HC01_EST_VC24,HC01_MOE_VC24,HC02_EST_VC24,HC02_MOE_VC24,HC03_EST_VC24,HC03_MOE_VC24,HC01_EST_VC25,HC01_MOE_VC25,HC02_EST_VC25,HC02_MOE_VC25,HC03_EST_VC25,HC03_MOE_VC25,HC01_EST_VC26,HC01_MOE_VC26,HC02_EST_VC26,HC02_MOE_VC26,HC03_EST_VC26,HC03_MOE_VC26,HC01_EST_VC27,HC01_MOE_VC27,HC02_EST_VC27,HC02_MOE_VC27,HC03_EST_VC27,HC03_MOE_VC27,HC01_EST_VC28,HC01_MOE_VC28,HC02_EST_VC28,HC02_MOE_VC28,HC03_EST_VC28,HC03_MOE_VC28,HC01_EST_VC29,HC01_MOE_VC29,HC02_EST_VC29,HC02_MOE_VC29,HC03_EST_VC29,HC03_MOE_VC29,HC01_EST_VC30,HC01_MOE_VC30,HC02_EST_VC30,HC02_MOE_VC30,HC03_EST_VC30,HC03_MOE_VC30,HC01_EST_VC31,HC01_MOE_VC31,HC02_EST_VC31,HC02_MOE_VC31,HC03_EST_VC31,HC03_MOE_VC31,HC01_EST_VC32,HC01_MOE_VC32,HC02_EST_VC32,HC02_MOE_VC32,HC03_EST_VC32,HC03_MOE_VC32,HC01_EST_VC35,HC01_MOE_VC35,HC02_EST_VC35,HC02_MOE_VC35,HC03_EST_VC35,HC03_MOE_VC35,HC01_EST_VC36,HC01_MOE_VC36,HC02_EST_VC36,HC02_MOE_VC36,HC03_EST_VC36,HC03_MOE_VC36,HC01_EST_VC37,HC01_MOE_VC37,HC02_EST_VC37,HC02_MOE_VC37,HC03_EST_VC37,HC03_MOE_VC37,HC01_EST_VC38,HC01_MOE_VC38,HC02_EST_VC38,HC02_MOE_VC38,HC03_EST_VC38,HC03_MOE_VC38,HC01_EST_VC39,HC01_MOE_VC39,HC02_EST_VC39,HC02_MOE_VC39,HC03_EST_VC39,HC03_MOE_VC39,HC01_EST_VC42,HC01_MOE_VC42,HC02_EST_VC42,HC02_MOE_VC42,HC03_EST_VC42,HC03_MOE_VC42,HC01_EST_VC43,HC01_MOE_VC43,HC02_EST_VC43,HC02_MOE_VC43,HC03_EST_VC43,HC03_MOE_VC43
Id,Id2,Geography,Total; Estimate; Total population,Total; Margin of Error; Total population,Male; Estimate; Total population,Male; Margin of Error; Total population,Female; Estimate; Total population,Female; Margin of Error; Total population,Total; Estimate; AGE - Under 5 years,Total; Margin of Error; AGE - Under 5 years,Male; Estimate; AGE - Under 5 years,Male; Margin of Error; AGE - Under 5 years,Female; Estimate; AGE - Under 5 years,Female; Margin of Error; AGE - Under 5 years,Total; Estimate; AGE - 5 to 9 years,Total; Margin of Error; AGE - 5 to 9 years,Male; Estimate; AGE - 5 to 9 years,Male; Margin of Error; AGE - 5 to 9 years,Female; Estimate; AGE - 5 to 9 years,Female; Margin of Error; AGE - 5 to 9 years,Total; Estimate; AGE - 10 to 14 years,Total; Margin of Error; AGE - 10 to 14 years,Male; Estimate; AGE - 10 to 14 years,Male; Margin of Error; AGE - 10 to 14 years,Female; Estimate; AGE - 10 to 14 years,Female; Margin of Error; AGE - 10 to 14 years,Total; Estimate; AGE - 15 to 19 years,Total; Margin of Error; AGE - 15 to 19 years,Male; Estimate; AGE - 15 to 19 years,Male; Margin of Error; AGE - 15 to 19 years,Female; Estimate; AGE - 15 to 19 years,Female; Margin of Error; AGE - 15 to 19 years,Total; Estimate; AGE - 20 to 24 years,Total; Margin of Error; AGE - 20 to 24 years,Male; Estimate; AGE - 20 to 24 years,Male; Margin of Error; AGE - 20 to 24 years,Female; Estimate; AGE - 20 to 24 years,Female; Margin of Error; AGE - 20 to 24 years,Total; Estimate; AGE - 25 to 29 years,Total; Margin of Error; AGE - 25 to 29 years,Male; Estimate; AGE - 25 to 29 years,Male; Margin of Error; AGE - 25 to 29 years,Female; Estimate; AGE - 25 to 29 years,Female; Margin of Error; AGE - 25 to 29 years,Total; Estimate; AGE - 30 to 34 years,Total; Margin of Error; AGE - 30 to 34 years,Male; Estimate; AGE - 30 to 34 years,Male; Margin of Error; AGE - 30 to 34 years,Female; Estimate; AGE - 30 to 34 years,Female; Margin of Error; AGE - 30 to 34 years,Total; Estimate; AGE - 35 to 39 years,Total; Margin of Error; AGE - 35 to 39 years,Male; Estimate; AGE - 35 to 39 years,Male; Margin of Error; AGE - 35 to 39 years,Female; Estimate; AGE - 35 to 39 years,Female; Margin of Error; AGE - 35 to 39 years,Total; Estimate; AGE - 40 to 44 years,Total; Margin of Error; AGE - 40 to 44 years,Male; Estimate; AGE - 40 to 44 years,Male; Margin of Error; AGE - 40 to 44 years,Female; Estimate; AGE - 40 to 44 years,Female; Margin of Error; AGE - 40 to 44 years,Total; Estimate; AGE - 45 to 49 years,Total; Margin of Error; AGE - 45 to 49 years,Male; Estimate; AGE - 45 to 49 years,Male; Margin of Error; AGE - 45 to 49 years,Female; Estimate; AGE - 45 to 49 years,Female; Margin of Error; AGE - 45 to 49 years,Total; Estimate; AGE - 50 to 54 years,Total; Margin of Error; AGE - 50 to 54 years,Male; Estimate; AGE - 50 to 54 years,Male; Margin of Error; AGE - 50 to 54 years,Female; Estimate; AGE - 50 to 54 years,Female; Margin of Error; AGE - 50 to 54 years,Total; Estimate; AGE - 55 to 59 years,Total; Margin of Error; AGE - 55 to 59 years,Male; Estimate; AGE - 55 to 59 years,Male; Margin of Error; AGE - 55 to 59 years,Female; Estimate; AGE - 55 to 59 years,Female; Margin of Error; AGE - 55 to 59 years,Total; Estimate; AGE - 60 to 64 years,Total; Margin of Error; AGE - 60 to 64 years,Male; Estimate; AGE - 60 to 64 years,Male; Margin of Error; AGE - 60 to 64 years,Female; Estimate; AGE - 60 to 64 years,Female; Margin of Error; AGE - 60 to 64 years,Total; Estimate; AGE - 65 to 69 years,Total; Margin of Error; AGE - 65 to 69 years,Male; Estimate; AGE - 65 to 69 years,Male; Margin of Error; AGE - 65 to 69 years,Female; Estimate; AGE - 65 to 69 years,Female; Margin of Error; AGE - 65 to 69 years,Total; Estimate; AGE - 70 to 74 years,Total; Margin of Error; AGE - 70 to 74 years,Male; Estimate; AGE - 70 to 74 years,Male; Margin of Error; AGE - 70 to 74 years,Female; Estimate; AGE - 70 to 74 years,Female; Margin of Error; AGE - 70 to 74 years,Total; Estimate; AGE - 75 to 79 years,Total; Margin of Error; AGE - 75 to 79 years,Male; Estimate; AGE - 75 to 79 years,Male; Margin of Error; AGE - 75 to 79 years,Female; Estimate; AGE - 75 to 79 years,Female; Margin of Error; AGE - 75 to 79 years,Total; Estimate; AGE - 80 to 84 years,Total; Margin of Error; AGE - 80 to 84 years,Male; Estimate; AGE - 80 to 84 years,Male; Margin of Error; AGE - 80 to 84 years,Female; Estimate; AGE - 80 to 84 years,Female; Margin of Error; AGE - 80 to 84 years,Total; Estimate; AGE - 85 years and over,Total; Margin of Error; AGE - 85 years and over,Male; Estimate; AGE - 85 years and over,Male; Margin of Error; AGE - 85 years and over,Female; Estimate; AGE - 85 years and over,Female; Margin of Error; AGE - 85 years and over,Total; Estimate; SELECTED AGE CATEGORIES - 5 to 14 years,Total; Margin of Error; SELECTED AGE CATEGORIES - 5 to 14 years,Male; Estimate; SELECTED AGE CATEGORIES - 5 to 14 years,Male; Margin of Error; SELECTED AGE CATEGORIES - 5 to 14 years,Female; Estimate; SELECTED AGE CATEGORIES - 5 to 14 years,Female; Margin of Error; SELECTED AGE CATEGORIES - 5 to 14 years,Total; Estimate; SELECTED AGE CATEGORIES - 15 to 17 years,Total; Margin of Error; SELECTED AGE CATEGORIES - 15 to 17 years,Male; Estimate; SELECTED AGE CATEGORIES - 15 to 17 years,Male; Margin of Error; SELECTED AGE CATEGORIES - 15 to 17 years,Female; Estimate; SELECTED AGE CATEGORIES - 15 to 17 years,Female; Margin of Error; SELECTED AGE CATEGORIES - 15 to 17 years,Total; Estimate; SELECTED AGE CATEGORIES - 18 to 24 years,Total; Margin of Error; SELECTED AGE CATEGORIES - 18 to 24 years,Male; Estimate; SELECTED AGE CATEGORIES - 18 to 24 years,Male; Margin of Error; SELECTED AGE CATEGORIES - 18 to 24 years,Female; Estimate; SELECTED AGE CATEGORIES - 18 to 24 years,Female; Margin of Error; SELECTED AGE CATEGORIES - 18 to 24 years,Total; Estimate; SELECTED AGE CATEGORIES - 15 to 44 years,Total; Margin of Error; SELECTED AGE CATEGORIES - 15 to 44 years,Male; Estimate; SELECTED AGE CATEGORIES - 15 to 44 years,Male; Margin of Error; SELECTED AGE CATEGORIES - 15 to 44 years,Female; Estimate; SELECTED AGE CATEGORIES - 15 to 44 years,Female; Margin of Error; SELECTED AGE CATEGORIES - 15 to 44 years,Total; Estimate; SELECTED AGE CATEGORIES - 16 years and over,Total; Margin of Error; SELECTED AGE CATEGORIES - 16 years and over,Male; Estimate; SELECTED AGE CATEGORIES - 16 years and over,Male; Margin of Error; SELECTED AGE CATEGORIES - 16 years and over,Female; Estimate; SELECTED AGE CATEGORIES - 16 years and over,Female; Margin of Error; SELECTED AGE CATEGORIES - 16 years and over,Total; Estimate; SELECTED AGE CATEGORIES - 18 years and over,Total; Margin of Error; SELECTED AGE CATEGORIES - 18 years and over,Male; Estimate; SELECTED AGE CATEGORIES - 18 years and over,Male; Margin of Error; SELECTED AGE CATEGORIES - 18 years and over,Female; Estimate; SELECTED AGE CATEGORIES - 18 years and over,Female; Margin of Error; SELECTED AGE CATEGORIES - 18 years and over,Total; Estimate; SELECTED AGE CATEGORIES - 60 years and over,Total; Margin of Error; SELECTED AGE CATEGORIES - 60 years and over,Male; Estimate; SELECTED AGE CATEGORIES - 60 years and over,Male; Margin of Error; SELECTED AGE CATEGORIES - 60 years and over,Female; Estimate; SELECTED AGE CATEGORIES - 60 years and over,Female; Margin of Error; SELECTED AGE CATEGORIES - 60 years and over,Total; Estimate; SELECTED AGE CATEGORIES - 62 years and over,Total; Margin of Error; SELECTED AGE CATEGORIES - 62 years and over,Male; Estimate; SELECTED AGE CATEGORIES - 62 years and over,Male; Margin of Error; SELECTED AGE CATEGORIES - 62 years and over,Female; Estimate; SELECTED AGE CATEGORIES - 62 years and over,Female; Margin of Error; SELECTED AGE CATEGORIES - 62 years and over,Total; Estimate; SELECTED AGE CATEGORIES - 65 years and over,Total; Margin of Error; SELECTED AGE CATEGORIES - 65 years and over,Male; Estimate; SELECTED AGE CATEGORIES - 65 years and over,Male; Margin of Error; SELECTED AGE CATEGORIES - 65 years and over,Female; Estimate; SELECTED AGE CATEGORIES - 65 years and over,Female; Margin of Error; SELECTED AGE CATEGORIES - 65 years and over,Total; Estimate; SELECTED AGE CATEGORIES - 75 years and over,Total; Margin of Error; SELECTED AGE CATEGORIES - 75 years and over,Male; Estimate; SELECTED AGE CATEGORIES - 75 years and over,Male; Margin of Error; SELECTED AGE CATEGORIES - 75 years and over,Female; Estimate; SELECTED AGE CATEGORIES - 75 years and over,Female; Margin of Error; SELECTED AGE CATEGORIES - 75 years and over,Total; Estimate; SUMMARY INDICATORS - Median age (years),Total; Margin of Error; SUMMARY INDICATORS - Median age (years),Male; Estimate; SUMMARY INDICATORS - Median age (years),Male; Margin of Error; SUMMARY INDICATORS - Median age (years),Female; Estimate; SUMMARY INDICATORS - Median age (years),Female; Margin of Error; SUMMARY INDICATORS - Median age (years),Total; Estimate; SUMMARY INDICATORS - Sex ratio (males per 100 females),Total; Margin of Error; SUMMARY INDICATORS - Sex ratio (males per 100 females),Male; Estimate; SUMMARY INDICATORS - Sex ratio (males per 100 females),Male; Margin of Error; SUMMARY INDICATORS - Sex ratio (males per 100 females),Female; Estimate; SUMMARY INDICATORS - Sex ratio (males per 100 females),Female; Margin of Error; SUMMARY INDICATORS - Sex ratio (males per 100 females),Total; Estimate; SUMMARY INDICATORS - Age dependency ratio,Total; Margin of Error; SUMMARY INDICATORS - Age dependency ratio,Male; Estimate; SUMMARY INDICATORS - Age dependency ratio,Male; Margin of Error; SUMMARY INDICATORS - Age dependency ratio,Female; Estimate; SUMMARY INDICATORS - Age dependency ratio,Female; Margin of Error; SUMMARY INDICATORS - Age dependency ratio,Total; Estimate; SUMMARY INDICATORS - Old-age dependency ratio,Total; Margin of Error; SUMMARY INDICATORS - Old-age dependency ratio,Male; Estimate; SUMMARY INDICATORS - Old-age dependency ratio,Male; Margin of Error; SUMMARY INDICATORS - Old-age dependency ratio,Female; Estimate; SUMMARY INDICATORS - Old-age dependency ratio,Female; Margin of Error; SUMMARY INDICATORS - Old-age dependency ratio,Total; Estimate; SUMMARY INDICATORS - Child dependency ratio,Total; Margin of Error; SUMMARY INDICATORS - Child dependency ratio,Male; Estimate; SUMMARY INDICATORS - Child dependency ratio,Male; Margin of Error; SUMMARY INDICATORS - Child dependency ratio,Female; Estimate; SUMMARY INDICATORS - Child dependency ratio,Female; Margin of Error; SUMMARY INDICATORS - Child dependency ratio,Total; Estimate; PERCENT IMPUTED - Sex,Total; Margin of Error; PERCENT IMPUTED - Sex,Male; Estimate; PERCENT IMPUTED - Sex,Male; Margin of Error; PERCENT IMPUTED - Sex,Female; Estimate; PERCENT IMPUTED - Sex,Female; Margin of Error; PERCENT IMPUTED - Sex,Total; Estimate; PERCENT IMPUTED - Age,Total; Margin of Error; PERCENT IMPUTED - Age,Male; Estimate; PERCENT IMPUTED - Age,Male; Margin of Error; PERCENT IMPUTED - Age,Female; Estimate; PERCENT IMPUTED - Age,Female; Margin of Error; PERCENT IMPUTED - Age
310M200US10180,10180,"Abilene, TX Metro Area",166900,2419,85914,1611,80986,1408,6.5,0.3,6.7,0.6,6.3,0.4,6.6,0.7,6.6,1.1,6.6,1.0,6.4,0.8,6.2,1.1,6.6,1.1,7.5,0.6,8.6,1.1,6.3,0.6,9.4,0.6,9.8,1.0,9.1,0.6,7.8,0.5,8.4,0.6,7.2,0.8,7.0,0.5,7.6,0.8,6.5,0.5,5.8,0.8,6.3,1.0,5.3,1.0,5.2,0.7,5.3,0.9,5.1,0.8,5.4,0.4,5.5,0.5,5.3,0.6,6.6,0.5,5.9,0.4,7.4,0.9,6.0,0.7,6.1,1.0,5.9,0.9,5.1,0.6,4.8,0.9,5.5,0.8,4.3,0.5,3.9,0.5,4.8,0.7,3.5,0.5,3.1,0.6,4.0,0.7,2.9,0.5,2.4,0.5,3.5,0.7,1.7,0.3,1.4,0.5,1.9,0.5,2.1,0.5,1.5,0.5,2.7,0.7,13.0,0.5,12.8,0.7,13.2,0.7,3.6,0.3,4.2,0.6,3.0,0.5,13.3,0.6,14.2,0.9,12.4,0.6,42.8,0.8,45.9,1.1,39.5,1.0,79.0,0.7,78.8,1.0,79.2,1.0,76.9,0.5,76.2,0.9,77.6,0.8,19.7,0.8,17.1,1.0,22.4,1.0,17.3,0.8,15.1,1.0,19.7,0.9,14.5,0.5,12.3,0.6,16.9,0.7,6.7,0.4,5.3,0.4,8.1,0.5,34.0,0.6,33.0,0.8,36.8,0.9,106.1,2.3,,,,,60.4,1.9,,,,,23.3,1.1,,,,,37.1,1.2,,,,,0.0,,,,,,0.9,,,,,
310M200US10380,10380,"Aguadilla-Isabela, PR Metro Area",322079,2236,159038,2007,163041,1875,4.5,0.3,4.9,0.6,4.2,0.7,6.4,0.6,6.5,0.9,6.4,0.7,6.5,0.6,7.5,1.1,5.5,0.7,7.2,0.5,7.9,0.9,6.4,0.7,7.0,0.6,7.2,0.8,6.8,0.7,5.4,0.3,5.4,0.5,5.4,0.5,6.1,0.3,5.9,0.6,6.3,0.3,6.5,0.7,6.8,1.1,6.2,0.8,6.7,0.6,6.5,1.0,7.0,0.9,6.5,0.3,6.7,0.5,6.3,0.2,6.5,0.3,6.0,0.4,7.0,0.3,6.7,0.6,7.1,0.9,6.3,0.8,6.3,0.6,5.1,0.8,7.5,0.7,5.8,0.5,5.8,0.6,5.8,0.6,4.8,0.5,4.5,0.7,5.1,0.6,2.9,0.4,2.5,0.5,3.3,0.6,2.0,0.3,2.0,0.4,1.9,0.5,2.1,0.4,1.7,0.4,2.5,0.7,12.9,0.5,14.0,0.7,11.9,0.4,4.1,0.1,4.6,0.5,3.5,0.5,10.1,0.4,10.5,0.6,9.7,0.6,38.9,0.3,39.6,0.6,38.1,0.6,81.2,0.5,79.7,0.8,82.7,0.7,78.5,0.4,76.5,0.8,80.4,0.8,24.0,0.6,21.7,0.9,26.2,0.8,21.5,0.6,19.4,0.7,23.5,0.8,17.7,0.4,16.6,0.4,18.7,0.5,7.0,0.2,6.3,0.2,7.8,0.3,40.3,0.5,38.2,1.1,42.3,1.0,97.5,1.9,,,,,64.5,1.2,,,,,29.1,0.8,,,,,35.4,0.8,,,,,0.1,,,,,,0.8,,,,,
310M200US10420,10420,"Akron, OH Metro Area",703825,,341503,984,362322,984,5.4,0.1,5.6,0.1,5.1,0.1,5.6,0.3,5.8,0.5,5.5,0.4,6.1,0.3,6.7,0.5,5.5,0.4,7.0,0.2,7.3,0.3,6.8,0.2,7.8,0.1,8.1,0.2,7.5,0.1,6.4,0.1,6.4,0.1,6.3,0.2,6.0,0.1,6.0,0.2,5.9,0.2,5.5,0.3,5.6,0.5,5.3,0.5,6.3,0.3,6.3,0.5,6.4,0.5,6.6,0.1,6.6,0.1,6.6,0.1,7.5,0.1,7.4,0.1,7.5,0.2,7.5,0.3,7.2,0.5,7.7,0.5,6.6,0.3,6.7,0.5,6.4,0.5,5.2,0.3,5.0,0.4,5.3,0.4,3.6,0.3,3.4,0.4,3.8,0.4,2.7,0.2,2.4,0.3,2.9,0.3,1.9,0.2,1.9,0.3,2.0,0.3,2.4,0.2,1.5,0.3,3.3,0.3,11.8,0.1,12.5,0.2,11.1,0.2,4.0,0.1,4.1,0.2,3.8,0.1,10.8,0.1,11.3,0.2,10.4,0.2,38.9,0.2,39.7,0.2,38.2,0.2,81.6,0.2,80.4,0.3,82.7,0.3,78.9,0.1,77.7,0.2,80.0,0.2,22.4,0.3,20.9,0.5,23.8,0.5,19.6,0.2,18.0,0.4,21.2,0.4,15.8,0.1,14.1,0.1,17.4,0.1,7.0,0.1,5.7,0.1,8.2,0.1,40.2,0.3,38.8,0.3,41.7,0.5,94.3,0.5,,,,,58.6,0.3,,,,,25.1,0.2,,,,,33.5,0.1,,,,,0.1,,,,,,5.2,,,,,
310M200US10500,10500,"Albany, GA Metro Area",152596,1637,71387,1098,81209,1290,6.7,0.2,7.0,0.5,6.3,0.6,7.2,0.8,9.0,1.4,5.6,1.0,6.9,0.8,6.4,1.3,7.3,1.1,7.4,0.8,7.6,1.3,7.2,0.9,7.6,0.6,7.6,1.3,7.6,0.6,6.4,0.5,6.2,0.9,6.7,0.4,6.4,0.6,6.2,1.0,6.6,0.7,6.6,1.0,7.0,1.2,6.2,1.3,5.4,0.8,4.7,0.9,6.0,1.2,5.9,0.4,5.9,0.4,5.9,0.7,6.8,0.4,7.0,0.8,6.6,0.5,5.7,0.7,5.1,0.9,6.1,1.0,6.9,0.8,7.2,1.0,6.7,1.1,4.7,0.6,4.6,0.8,4.7,0.9,4.0,0.6,3.9,0.8,4.1,0.8,2.1,0.4,1.7,0.5,2.4,0.5,1.8,0.4,1.4,0.5,2.1,0.6,1.7,0.4,1.4,0.6,1.9,0.5,14.1,0.6,15.4,0.8,12.9,0.9,4.4,0.4,4.0,0.7,4.6,0.7,10.6,0.5,11.1,1.2,10.1,0.5,39.8,0.8,39.3,1.1,40.2,1.2,77.7,0.6,76.6,0.9,78.7,1.2,74.9,0.4,73.5,0.9,76.1,0.8,21.1,0.9,20.2,1.1,21.9,1.2,17.8,0.9,16.5,1.2,18.9,1.1,14.2,0.5,13.0,0.6,15.2,0.5,5.5,0.3,4.5,0.4,6.4,0.4,36.4,0.5,35.0,0.8,37.2,1.2,87.9,2.0,,,,,64.8,1.3,,,,,23.4,0.9,,,,,41.4,0.9,,,,,0.0,,,,,,1.5,,,,,
310M200US10540,10540,"Albany, OR Metro Area",119356,,59310,688,60046,688,6.0,0.3,6.6,0.3,5.5,0.6,6.2,0.7,6.8,1.1,5.6,1.1,6.8,0.7,7.0,1.1,6.6,1.0,6.1,0.6,6.5,0.9,5.8,0.7,5.5,0.4,5.8,0.7,5.2,0.4,5.8,0.4,5.9,0.8,5.8,0.4,6.8,1.1,6.0,0.9,7.5,1.5,5.8,1.0,5.1,1.2,6.5,1.4,6.2,1.2,6.4,1.3,5.9,1.7,6.4,0.6,6.6,0.8,6.1,0.8,7.0,0.5,7.1,0.7,6.9,0.8,7.3,0.8,6.9,1.1,7.6,1.0,6.8,0.8,7.1,1.1,6.4,1.1,4.9,0.7,5.2,1.0,4.5,0.9,5.5,0.7,4.9,0.9,6.1,1.0,2.5,0.4,2.6,0.6,2.3,0.6,2.4,0.4,2.1,0.6,2.6,0.6,2.1,0.5,1.3,0.6,3.0,0.7,13.0,0.5,13.8,0.6,12.2,0.8,4.3,0.5,4.4,0.6,4.2,0.7,7.4,0.6,8.0,0.9,6.8,0.4,36.2,1.0,35.8,0.8,36.7,1.5,79.5,0.5,78.0,0.9,80.9,1.1,76.7,0.2,75.2,0.6,78.1,0.7,24.1,0.9,23.3,1.3,25.0,1.3,21.0,0.8,20.3,1.1,21.6,1.1,17.4,0.4,16.2,0.6,18.6,0.5,7.0,0.2,6.1,0.3,7.9,0.2,40.7,1.4,40.1,0.8,42.1,1.9,98.8,2.3,,,,,68.6,1.2,,,,,29.3,0.9,,,,,39.3,0.5,,,,,0.0,,,,,,1.0,,,,,
310M200US10580,10580,"Albany-Schenectady-Troy, NY Metro Area",880167,,428706,1530,451461,1530,5.2,0.1,5.2,0.2,5.1,0.2,5.3,0.3,5.9,0.4,4.8,0.4,6.2,0.3,6.2,0.4,6.2,0.4,7.1,0.2,7.4,0.3,6.9,0.3,8.0,0.2,8.5,0.3,7.6,0.3,6.4,0.2,6.9,0.3,6.0,0.2,6.0,0.1,6.1,0.2,6.0,0.2,5.6,0.4,5.6,0.4,5.7,0.5,6.4,0.4,6.2,0.4,6.5,0.5,6.9,0.2,7.2,0.2,6.6,0.2,7.6,0.2,7.6,0.2,7.7,0.2,7.3,0.3,7.4,0.4,7.1,0.3,6.4,0.3,6.2,0.5,6.6,0.3,5.3,0.2,5.3,0.3,5.2,0.3,3.4,0.2,3.0,0.3,3.9,0.3,2.6,0.2,2.3,0.2,2.8,0.3,2.0,0.2,1.7,0.2,2.3,0.3,2.2,0.2,1.4,0.2,3.1,0.3,11.5,0.1,12.0,0.1,11.0,0.2,3.6,0.1,3.8,0.2,3.4,0.2,11.6,0.2,12.1,0.3,11.1,0.3,39.7,0.2,40.6,0.3,38.8,0.4,82.0,0.1,81.4,0.3,82.5,0.3,79.7,0.1,79.0,0.3,80.4,0.3,21.9,0.3,19.9,0.5,23.8,0.4,19.5,0.3,17.6,0.4,21.2,0.3,15.5,0.1,13.7,0.1,17.2,0.2,6.8,0.1,5.4,0.1,8.1,0.2,40.0,0.4,38.6,0.5,41.4,0.5,95.0,0.7,,,,,55.7,0.3,,,,,24.1,0.2,,,,,31.6,0.1,,,,,0.0,,,,,,2.2,,,,,
310M200US10740,10740,"Albuquerque, NM Metro Area",905213,2468,444314,1602,460899,1795,6.2,0.1,6.3,0.2,6.0,0.2,6.5,0.4,6.5,0.5,6.4,0.5,6.7,0.4,7.1,0.5,6.3,0.4,6.3,0.2,6.6,0.2,6.1,0.2,6.9,0.2,7.0,0.3,6.7,0.2,7.1,0.1,7.5,0.2,6.8,0.1,7.1,0.2,7.4,0.2,6.8,0.2,6.2,0.3,6.0,0.6,6.3,0.4,6.1,0.4,6.4,0.6,5.8,0.5,6.3,0.1,6.4,0.2,6.2,0.2,7.0,0.1,7.0,0.2,7.0,0.1,6.7,0.3,6.5,0.4,7.0,0.4,6.3,0.3,6.0,0.4,6.7,0.4,5.0,0.2,4.7,0.3,5.2,0.3,3.5,0.2,3.4,0.4,3.6,0.3,2.7,0.2,2.4,0.3,3.0,0.3,1.8,0.2,1.5,0.2,2.2,0.3,1.5,0.2,1.1,0.2,1.9,0.3,13.2,0.1,13.6,0.1,12.7,0.2,3.8,0.1,4.0,0.1,3.7,0.1,9.4,0.1,9.7,0.2,9.2,0.1,39.7,0.2,40.9,0.2,38.6,0.2,79.4,0.2,78.7,0.3,80.0,0.3,76.8,0.1,76.1,0.2,77.6,0.2,20.8,0.3,19.1,0.4,22.5,0.4,18.2,0.3,16.5,0.4,19.8,0.5,14.5,0.1,13.2,0.2,15.8,0.2,6.0,0.1,5.0,0.1,7.0,0.1,37.6,0.3,36.2,0.4,38.8,0.5,96.4,0.5,,,,,60.5,0.3,,,,,23.3,0.3,,,,,37.2,0.2,,,,,0.0,,,,,,1.9,,,,,
310M200US10780,10780,"Alexandria, LA Metro Area",154872,,75697,896,79175,896,6.6,0.3,6.7,0.6,6.5,0.4,7.3,0.8,7.2,1.1,7.4,1.2,6.2,0.8,6.6,1.1,5.9,1.2,7.4,0.7,7.6,1.1,7.3,0.9,6.6,0.7,7.1,1.2,6.1,0.8,6.2,0.4,6.3,0.5,6.2,0.6,6.8,0.3,7.3,0.5,6.3,0.2,6.0,1.0,6.3,1.3,5.7,1.2,7.0,0.9,7.2,1.3,6.9,1.1,5.8,0.3,5.8,0.4,5.8,0.4,6.8,0.2,6.6,0.2,7.0,0.4,6.8,0.8,6.8,1.1,6.8,0.9,5.7,0.8,5.4,1.1,5.9,0.9,5.5,0.7,6.1,0.9,5.0,1.0,3.2,0.6,2.6,0.8,3.9,0.9,2.6,0.4,2.2,0.5,3.0,0.6,1.5,0.3,1.1,0.4,1.9,0.5,1.9,0.4,1.3,0.4,2.5,0.6,13.5,0.4,13.8,0.4,13.3,0.6,4.3,0.3,4.0,0.3,4.6,0.5,9.7,0.4,10.7,0.6,8.8,0.5,40.1,0.6,41.8,0.8,38.4,0.8,78.4,0.5,77.8,0.9,78.9,0.8,75.6,0.3,75.5,0.7,75.6,0.6,20.4,0.8,18.5,1.1,22.2,0.9,17.8,0.6,15.6,0.9,19.9,0.8,14.7,0.2,13.2,0.3,16.3,0.4,6.0,0.2,4.5,0.3,7.4,0.3,37.0,0.8,35.8,0.6,38.4,1.4,95.6,2.2,,,,,64.5,0.9,,,,,24.3,0.5,,,,,40.2,0.6,,,,,0.1,,,,,,1.3,,,,,
310M200US10900,10900,"Allentown-Bethlehem-Easton, PA-NJ Metro Area",829835,,406365,986,423470,986,5.3,0.1,5.4,0.1,5.1,0.2,5.7,0.3,6.1,0.5,5.4,0.4,6.7,0.3,7.2,0.5,6.3,0.4,6.7,0.1,7.1,0.2,6.4,0.2,6.4,0.2,6.6,0.3,6.3,0.2,5.9,0.1,6.2,0.2,5.6,0.1,5.8,0.1,5.8,0.2,5.9,0.2,5.7,0.4,5.8,0.5,5.6,0.4,6.6,0.4,6.7,0.5,6.5,0.4,7.1,0.1,7.0,0.2,7.1,0.2,7.6,0.1,7.7,0.1,7.4,0.1,7.1,0.3,7.3,0.4,7.0,0.4,6.5,0.3,6.4,0.4,6.7,0.4,5.3,0.3,5.3,0.3,5.3,0.4,3.8,0.2,3.5,0.3,4.1,0.3,2.7,0.2,2.4,0.2,3.0,0.3,2.2,0.2,1.9,0.2,2.5,0.3,2.8,0.2,1.7,0.3,3.8,0.3,12.4,0.1,13.2,0.2,11.7,0.1,3.9,0.1,4.2,0.2,3.7,0.1,9.2,0.2,9.5,0.3,8.9,0.2,37.2,0.2,38.2,0.3,36.2,0.2,81.0,0.2,80.1,0.3,81.8,0.3,78.3,0.1,77.2,0.2,79.4,0.2,23.3,0.3,21.2,0.4,25.4,0.4,20.6,0.3,18.5,0.4,22.5,0.4,16.8,0.1,14.8,0.2,18.7,0.2,7.7,0.1,6.1,0.1,9.3,0.1,41.3,0.3,39.9,0.4,42.6,0.3,96.0,0.5,,,,,62.5,0.3,,,,,27.3,0.3,,,,,35.2,0.2,,,,,0.0,,,,,,1.3,,,,,
310M200US11020,11020,"Altoona, PA Metro Area",125955,,61815,922,64140,922,5.1,0.1,5.3,0.2,4.8,0.1,6.0,0.9,6.0,1.4,5.9,1.4,6.1,0.9,6.6,1.3,5.7,1.0,5.8,0.3,5.9,0.3,5.6,0.4,6.3,0.5,7.0,0.8,5.7,0.2,5.6,0.3,5.9,0.6,5.4,0.1,5.5,0.2,5.7,0.4,5.4,0.2,6.0,0.7,5.4,1.0,6.6,0.9,5.9,0.9,6.5,1.1,5.3,1.1,6.3,0.2,6.4,0.3,6.3,0.2,7.0,0.1,7.1,0.3,6.9,0.1,8.1,0.9,7.9,1.6,8.2,1.0,7.2,0.7,7.8,1.0,6.5,0.9,5.8,0.7,5.7,0.9,5.9,0.9,4.3,0.7,3.9,0.8,4.7,0.8,3.0,0.6,2.9,0.6,3.2,0.8,2.7,0.5,2.0,0.6,3.4,0.8,3.3,0.6,2.0,0.7,4.5,0.9,12.1,0.2,12.6,0.9,11.6,1.0,3.4,0.2,3.5,0.1,3.3,0.4,8.7,0.5,9.5,0.8,8.0,0.2,35.1,0.6,36.4,1.0,33.9,0.7,81.8,0.4,80.9,0.9,82.7,1.2,79.4,,78.6,0.8,80.2,0.8,26.3,0.7,24.4,1.1,28.2,1.1,23.0,0.6,20.7,0.8,25.2,0.9,19.1,0.1,16.5,0.3,21.6,0.4,9.1,0.1,6.9,0.1,11.1,0.2,43.1,0.6,41.6,1.0,44.6,0.9,96.4,2.8,,,,,65.9,0.3,,,,,31.7,0.2,,,,,34.1,0.1,,,,,0.0,,,,,,0.8,,,,,
310M200US11100,11100,"Amarillo, TX Metro Area",261752,2264,132033,1926,129719,1063,7.3,0.2,7.6,0.3,7.1,0.2,8.4,0.5,8.3,0.9,8.5,0.9,6.1,0.6,6.2,1.0,5.9,0.8,6.7,0.4,7.4,0.7,6.1,0.5,7.4,0.4,7.3,0.5,7.5,0.5,7.2,0.2,7.2,0.3,7.2,0.3,7.5,0.4,7.9,0.5,7.2,0.4,6.1,0.5,7.0,0.7,5.1,0.7,6.0,0.6,5.5,0.8,6.5,0.8,6.2,0.4,6.1,0.5,6.3,0.5,6.6,0.3,6.7,0.4,6.6,0.3,6.7,0.6,6.5,0.7,6.9,0.9,4.9,0.4,5.2,0.6,4.7,0.7,4.0,0.4,3.6,0.5,4.4,0.6,3.3,0.4,3.1,0.5,3.5,0.5,2.2,0.4,1.7,0.4,2.8,0.5,1.6,0.3,1.1,0.3,2.0,0.4,1.6,0.3,1.6,0.5,1.7,0.4,14.5,0.3,14.5,0.5,14.4,0.4,4.3,0.3,4.8,0.5,3.8,0.3,9.9,0.4,10.0,0.6,9.8,0.4,40.9,0.5,42.3,0.7,39.5,0.6,76.5,0.4,76.1,0.6,76.9,0.6,73.9,0.3,73.1,0.7,74.7,0.4,17.7,0.6,16.3,0.7,19.2,0.9,15.6,0.6,14.0,0.8,17.2,0.8,12.8,0.3,11.1,0.4,14.5,0.4,5.5,0.2,4.4,0.3,6.5,0.3,34.5,0.4,33.9,0.6,35.6,0.6,101.8,1.6,,,,,63.6,0.9,,,,,20.9,0.6,,,,,42.7,0.6,,,,,0.1,,,,,,1.3,,,,,
310M200US11180,11180,"Ames, IA Metro Area",94073,,49041,623,45032,623,5.3,0.5,5.0,0.5,5.7,0.9,4.6,0.7,5.0,1.2,4.2,0.8,4.6,0.8,4.3,1.1,5.0,0.9,14.0,2.2,13.3,2.4,14.7,3.2,18.8,1.9,20.8,2.3,16.6,2.9,8.2,1.0,9.5,1.8,6.8,0.9,5.6,0.5,5.5,0.6,5.6,0.7,6.2,1.0,6.5,1.2,5.8,1.3,3.4,0.9,3.3,1.1,3.5,1.1,4.2,0.3,4.1,0.4,4.2,0.3,4.7,0.3,4.5,0.4,5.1,0.4,4.9,0.8,4.5,1.1,5.4,1.1,4.7,0.9,4.5,1.1,4.8,1.1,3.4,0.6,3.5,0.6,3.3,0.8,2.5,0.6,2.0,0.7,3.0,0.8,2.4,0.5,2.2,0.6,2.6,0.7,1.4,0.6,1.0,0.6,1.8,0.8,1.2,0.5,0.5,0.4,1.9,0.8,9.3,0.5,9.2,0.7,9.3,0.8,2.5,0.2,2.5,0.3,2.6,0.3,30.3,1.3,31.6,1.6,28.8,1.9,56.2,0.8,59.1,0.9,53.0,1.1,84.6,0.3,85.2,0.7,84.1,0.8,82.8,,83.2,0.6,82.4,0.6,15.4,1.0,13.7,1.2,17.3,1.2,13.5,0.9,12.1,1.1,15.0,1.0,10.8,0.5,9.2,0.4,12.5,0.6,4.9,0.2,3.7,0.1,6.3,0.3,26.9,1.0,25.7,0.7,28.3,0.8,108.9,2.9,,,,,38.7,0.9,,,,,14.9,0.7,,,,,23.8,0.2,,,,,0.3,,,,,,0.7,,,,,
310M200US11260,11260,"Anchorage, AK Metro Area",398892,,204572,1217,194320,1217,7.2,0.2,6.9,0.4,7.6,0.5,7.1,0.4,7.2,0.7,7.0,0.7,7.3,0.5,7.2,0.8,7.4,0.6,6.7,0.4,7.0,0.7,6.4,0.5,8.6,0.4,9.4,0.7,7.7,0.4,8.5,0.2,9.0,0.4,8.1,0.2,7.7,0.3,7.6,0.5,7.7,0.4,6.7,0.5,6.8,0.6,6.5,0.7,6.2,0.5,5.8,0.7,6.7,0.6,6.1,0.3,6.2,0.4,6.0,0.4,7.0,0.2,6.8,0.3,7.1,0.2,6.8,0.4,6.7,0.4,6.9,0.6,5.0,0.4,5.0,0.5,5.0,0.6,3.4,0.3,3.3,0.5,3.6,0.5,2.4,0.3,2.4,0.5,2.4,0.4,1.6,0.3,1.5,0.3,1.7,0.4,0.9,0.2,0.8,0.3,1.1,0.4,0.8,0.2,0.5,0.2,1.1,0.4,14.4,0.3,14.4,0.5,14.4,0.3,3.9,0.1,3.9,0.4,3.9,0.4,11.4,0.2,12.5,0.4,10.2,0.2,44.4,0.3,45.6,0.6,43.2,0.4,77.0,0.3,77.3,0.6,76.7,0.5,74.5,0.1,74.8,0.4,74.1,0.4,14.2,0.4,13.4,0.5,14.9,0.6,12.0,0.4,11.3,0.5,12.7,0.5,9.1,0.2,8.4,0.3,9.9,0.3,3.3,0.2,2.7,0.3,3.9,0.3,32.7,0.3,32.0,0.5,33.4,0.3,105.3,1.3,,,,,53.0,0.5,,,,,13.9,0.4,,,,,39.1,0.1,,,,,0.2,,,,,,3.1,,,,,
